,Unnamed: 0,id,cleaned_word_list,cleaned_word_list_nouns
0,0,1235252458189991936,pulling together flavours ingredients sourced around world heady concoction new menu,ingredients world heady concoction menu
1,1,1234890057158479872,ebullient peruvian city rich ornate architecture plenty hungry traveller piquant,city architecture plenty traveller piquant
2,2,1234444353835237376,favourite restaurant dessert always order lemon tart menu ne,restaurant dessert order tart menu ne
3,3,1234081967911600130,boost sunday roast delicious salad honey glazed carrots join caramelised walnuts,boost sunday salad honey carrots join walnuts
4,4,1233719579647631360,aside giving us finest minds shaped world austria capital boasts lively food,minds world austria capital food
5,5,1233440496783155202,dancing chilli fresh ginger flavours loving vegetarian take chinese ramen,chilli ginger flavours ramen
6,6,1233078110838456321,packed tightly tin sardines one dalston lane terraces pale smart walls stripped back wo,sardines dalston lane terraces walls
7,7,1232632413890760710,maldives grande dames full moon resort one mark sansom paces white sand beaches,maldives dames moon resort mark sansom paces sand beaches
8,8,1232270025739948032,somebody say pancake day secret recipe fluffiest pancakes ever,somebody day recipe pancakes
9,9,1231907634321731584,top shove tuesday pancakes tomorrow light like zingy lemon passion fruit curd sophi,shove tuesday tomorrow light zingy passion fruit curd sophi
10,10,1231545247378878465,please sweet tooth walnut vanilla filled rich cr decadence,walnut vanilla cr decadence
11,11,1231182855411306496,shake shrove tuesday next week mouth tingling kimchi pancakes,shake shrove tuesday week mouth kimchi pancakes
12,12,1230817475585024000,finally excited,
13,13,1230817340822106114,always,
14,14,1230817192096260097,half way across globe sent,way globe sent
15,15,1230816064172412929,seeking warmer climes take whistle stop tours colombia,warmer climes stop tours
16,16,1230815539834036225,brave hearted adventurers active escapes round put,brave adventurers escapes round
17,17,1230809243600793604,crisp blue skies drawing outside get walking boots explore blossoming british,crisp blue skies get boots
18,18,1230809095889965056,inside issue find inspiration seasonal gathering bountiful recipe collection inclu,issue gathering collection inclu
19,19,1230806376865239040,spring almost upon us beautiful new april issue today celebrates coming longer days warmin,spring issue today days
20,20,1230541390502912000,cruise offers gateway myriad different food cultures rewarding way get sense living like,cruise food cultures way sense living
21,21,1230178994856833026,pasta less dumplings tuscany fried gently butter sage delicious mid week meal simpl,pasta dumplings tuscany sage mid week meal simpl
22,22,1229816642353467395,laos capital combines french colonial architecture buddhist temples cuisine blends local produce,capital combines architecture buddhist temples blends produce
23,23,1229454254206857217,tuck bowl luxurious comfort food anna del conte traditional risotto alla milanese,tuck bowl comfort food anna del risotto alla milanese
24,24,1229008531002712064,please table show stopping gordon ramsey dessert gordon ramsey,please show ramsey dessert gordon ramsey
25,25,1228646145276219394,delve backstreets eastern sri lankan city find vibrant food scene friendly recepti,backstreets city food scene recepti
26,26,1228367055256248322,sumptuousness mingles warming spices persian stew little book,sumptuousness mingles spices book
27,27,1227921366298615815,perfect valentine day starter serve oysters mignonette sauce trout caviar,valentine day serve oysters trout caviar
28,28,1227642306561544193,love noodles weekday vietnamese food day andrea nguye,love noodles food day
29,29,1227279895748841472,bar raising new safari lodges opening across africa tanzania rwanda emma gregg introduces us,bar lodges africa tanzania rwanda emma gregg introduces
30,30,1227170636977647616,looking work experience magazine industry looking fabulous editorial interns join us,work experience magazine industry editorial interns
31,31,1226834204719296512,perfect dinner two steamy creamy mussels cider based broth,dinner creamy mussels broth
32,32,1226471815926681600,sundays made great puddings spoons ready incredible panna cotta,sundays puddings spoons panna cotta
33,33,1226109430384726017,home argentina best architecture wild westerly outpost makes perfect base touring one,home argentina architecture base
34,34,1225747045358673922,learn master baking delectable paul hollywood recipe raised pork pie,master paul hollywood recipe pork pie
35,35,1225384653026099201,portugal second city lent name wine made famous better time explore endu,city lent name wine time endu
36,36,1225022264145522688,cook dinner flash kwoklyn wan spicy beef stir fry chinese takeawa,cook dinner flash kwoklyn wan spicy beef stir fry takeawa
37,37,1224659877911580672,renowned certain insouciance india smallest state come long way since hippy trail days fleur ro,insouciance india state way trail days ro
38,38,1224297490582851585,best winter warmer sticky puds course orchard cook recipes fro,winter warmer course orchard cook fro
39,39,1223935106315902978,switch meat fish sunday josh niland spectacular bbq glazed fish ribs,switch meat sunday josh bbq ribs
40,40,1223572709818454016,pomegranates juiciest month find cooking jewelled delicacies frui,pomegranates month cooking delicacies
41,41,1222931251604131842,skillets ready try pierre koffman hearty confit duck cassoulet clas,skillets koffman hearty confit duck cassoulet clas
42,42,1222884502294450176,join partners go stand ac free piece art first guests,join partners piece art guests
43,43,1222568890548543488,souks marrakech many bucket list make year visit check hr guide cit,bucket list year visit check hr guide cit
44,44,1222206500086648832,fancy warming winter favourite try liz franklin photo angel,fancy winter try liz photo angel
45,45,1221760779671822336,looking easter break nestled snow capped swiss mountains alpina gstaad sings understa,easter break mountains sings understa
46,46,1221398393165176834,spotted season blood oranges shelves use whip beautiful meringue pies,season blood oranges shelves meringue pies
47,47,1221036001994428418,discover next adventure uk biggest event travel inspiration taking olymp,adventure event travel inspiration olymp
48,48,1220673615420588032,built personality californian city within city los feliz offers artistry slice la cool cul,personality city city los offers slice la cul
49,49,1220311228612075524,discover next adventure uk biggest event travel inspiration taking olymp,adventure event travel inspiration olymp
50,50,1220049248282140673,take dinner party menus next level complex aubergine shawarma,dinner party level aubergine shawarma
51,51,1219224066424479744,marketing australia first urban resort calile aesthete sub tropical fantasy imogen lepere,marketing australia resort calile fantasy imogen
52,52,1218861675996241920,cold sundays call steaming bowls soup try hearty french style fare today,sundays bowls soup style fare today
53,53,1218499288373661696,perth food drink scene undergone sea change late chic menus replacing basic fare,perth food scene sea change menus fare
54,54,1218138513159393280,plus sent uncover culinary secrets bhutan clarissa hyman laurie fletcher let,secrets hyman let
55,55,1218137538679975937,looking sunshine heads artisanal ayacucho brings best eats sleeps,heads brings eats
56,56,1218136821747666944,travel wise pulled snow boots get ice pick best,travel wise boots pick
57,57,1218135983033606145,sicily ripening lemons good use seasonal recipes make best super simple ove,lemons use recipes simple
58,58,1218135501288415232,keep healthy eating track vegetarian take chinese takeaway favourites satisfy,track satisfy
59,59,1218133956824043520,today bonanza february march issue perfect antidote mid winter blues inside find,today march issue antidote mid winter blues find
60,60,1217857807866875906,new zealand favourite chef imagined approach fish innovative fin gill cooki,zealand favourite chef approach fin gill cooki
61,61,1217049733425922053,mount meru emerges oasis within arusha new luxury resort set acres bea,mount meru oasis luxury resort acres
62,62,1216687346747351041,georgia capital winding streets steaming sulphur baths art treasures galore never fails enchan,capital streets baths art enchan
63,63,1216324956998569984,keep things simple lunch warming winter salad women chefs ne,things lunch winter women chefs
64,64,1215962570668093441,soak scrub relax rounded nine stunning spas offer unique views alongside tranquil therapies,soak scrub relax spas offer views therapies
65,65,1215600183863644160,bizarre beautiful woolpack bucks every contemporary design trend puts farrow ball paint swatches,woolpack bucks design trend ball paint swatches
66,66,1215237795914055681,start january sweet side pristine butterscotch tart legendary bakery tartine,start side pristine butterscotch tart bakery tartine
67,67,1214875409218756610,make year get skin country holiday rounded tour operators focusing,year get country holiday tour operators
68,68,1214513019079839745,lemony muffins filled lavish cream cheese filling yes please taken fa,lemony muffins cream cheese yes fa
69,69,1214311443866238977,served tangy pickled grapes fragrant fish curry offers kaleidoscope flavours tongue,tangy grapes curry offers flavours tongue
70,70,1213425860084162560,move nose tail eating fin gill try roetato bake new zealand josh niland,move fin gill roetato zealand josh niland
71,71,1213063475704082432,germany baden state capital offers visitors ebullient mix historic cutting edge wi,germany baden state capital offers visitors mix edge wi
72,72,1212701081358221312,start year high spirits scarfes bar zesty take classic negroni,year spirits bar zesty negroni
73,73,1212338702044794881,planning adventures bar raising new safari lodges opening across africa emma gregg introduces,planning adventures lodges africa emma gregg introduces
74,74,1211976307711631360,sipping perky party starter fireworks begin fly midnight concocted team,party starter fireworks team
75,75,1211613915920175104,break bread friends tomorrow tuck easy tear saffron bread ha,break friends tomorrow saffron bread ha
76,76,1211251530369785856,see christmas feasting something lighter try easy bagnetto bitter crudit,christmas something try bitter crudit
77,77,1210832515503493120,cheers christmas impress festive guests super simple sak cocktail team artesian,cheers guests sak cocktail team artesian
78,78,1210687565910728706,pull together simple last minute nibbles sweet carrot balls,minute nibbles carrot balls
79,79,1208714811346829313,go boxing day dish glazed ham year putting peach clove spiked gammon,day year peach clove gammon
80,80,1208352423200350208,looking snow filled post christmas escape plot course brilliant white vistas fun winter activities,snow post christmas escape plot course vistas winter activities
81,81,1208073361517170693,finesse roast potatoes ultimate recipe masterchef king kitchen,finesse roast potatoes recipe masterchef king kitchen
82,82,1207627650879172609,feeding vegetarian guests christmas tick veggie centrepiece list jos pizarro wild mushro,guests veggie centrepiece list jos mushro
83,83,1207265269028143109,sat bed sliced tomatoes cucumbers crimson hued olives tossed creamy feta making base,bed tomatoes cucumbers olives feta making base
84,84,1207208633983012865,stuck festive pudding serve like old fashioned pud espresso tart combines cof,pudding serve pud tart combines cof
85,85,1206986236528869377,party snacks sorted festive sweet salty nut selection happy,party snacks salty nut selection
86,86,1206623790073044992,wake greek inspired breakfast amalgamation freshly cut fruit beside galaktoboureko,wake greek breakfast amalgamation galaktoboureko
91,91,1206531572142411777,shaking,
92,92,1206523683600314368,festivities full swing food travel hq polish party prep january issue hitting,festivities food travel hq party prep issue
93,93,1206178096967299072,brush chill bleak winter day comforting cheese rich dish evokes memories alpine sk,brush chill winter day dish evokes memories sk
94,94,1205815712180264961,bright brash vegas always entertaining beyond razzamattaz influx top chefs making ci,brash vegas chefs ci
95,95,1205536643639328770,traditional domed santorini villas dazzling infinity pools fine dining alios ilios restaurant,villas infinity pools ilios restaurant
96,96,1204087104126492673,light fruity seasonal take traditional swiss roll makes perfect contrast heavier christmas de,fruity roll contrast christmas
97,97,1204003774966222848,bedecked bedouin charm biscuits coloured tents scattered across wadi al abiyad landscape conceal,charm biscuits tents wadi al abiyad landscape conceal
98,98,1203641387721228289,topped crumbly pangrattato made sourdough walnuts garlic rosemary grilled chicory makes,pangrattato walnuts chicory
99,99,1203278991429455874,renowned certain insouciance india smallest state come long way since hippy trail days fleur ro,insouciance india state way trail days ro
100,100,1203026377185923073,pour well deserved friday night vino nearly time cosy cruises,night vino time cruises
101,101,1202916610631258112,warm nourishing homely chard galette go weekend crowd pleaser,nourishing galette weekend crowd pleaser
102,102,1202637532871176192,sprouts boiled jazz sides christmas honey roasted brussels sprouts,sprouts jazz sides honey brussels sprouts
103,103,1202554215723421696,put rest relaxation front agenda guide nine uniquely positioned spas across th,relaxation front agenda spas th
104,104,1202275198956920834,oozing river warm molten chocolate decadent desserts guarantee smiling faces around di,river warm molten chocolate decadent guarantee di
105,105,1202191832412835841,belize toledo district delivers cuisine varied terrain combining local fishing traditions mayan,district delivers terrain fishing traditions
106,106,1201912742380220420,tender succulent slow roasted goat sings mediterranean flavours lemon olive oil,tender succulent goat sings flavours oil
107,107,1201829448846319617,fleur rollet manus talks sundays hackney wick chatty fishmongers snag table cornerstone lo,rollet manus talks hackney wick chatty fishmongers cornerstone lo
108,108,1201550393647476736,make glorious winter salad hour advance carrots time soak herby flavour,winter hour advance time soak flavour
109,109,1201467062834606080,spectacular scenery unhurried itineraries interesting fellow travellers share journey,scenery itineraries fellow travellers share journey
110,110,1201104670623752192,got weekend baking sorted recipe devilishly good chocolate hazelnut tartlets san fra,weekend baking chocolate hazelnut tartlets fra
111,111,1200742276659634176,steer clear trad tourist packed towns head lesser known locales christmas markets affordable,steer trad tourist towns locales markets
112,112,1200463198408921088,warm hands nourish soul bowl soba noodles crispy tofu enveloped spicy ramen broth,hands soul bowl soba noodles tofu spicy ramen
113,113,1200379890048098305,framed majestic himalayas cloaked myth bhutan colourful capital much feast senses,himalayas bhutan capital feast senses
114,114,1197201702061051904,filled red lentils flavoursome game bird stuffed squash winter warmer cold,lentils game bird winter warmer cold
115,115,1197118400847384576,hill tribes thailand verdant north famous night markets white temple bustling chiang ra,hill tribes night markets bustling chiang ra
116,116,1196839376103395330,serbia famous flavour filled raspberries exploring streets belgrade try old fa,flavour raspberries streets try fa
117,117,1196756011060776961,looking winter break include skis snow minus temperatures argentina top wine destination,winter break skis temperatures wine destination
118,118,1196031234863980544,nothing better bolster autumnal sunday roast bowl creamy sides add potato bay inf,nothing bolster roast bowl sides bay inf
119,119,1195668847073751040,booked richard corrigan new restaurant daffodil mulligan read one london biggest,restaurant daffodil mulligan london
120,120,1195249842802565120,creamy tender chicken livers contrast beautifully sharpness cherries venetian classic,tender chicken livers cherries
121,121,1195027413593403392,europe beautiful destinations fill tourists peak season visiting quieter cooler,europe destinations tourists season cooler
122,122,1194944078879825922,london home one best diverse food scenes world making le cordon bleu london fantastic,home diverse food scenes world cordon bleu
123,123,1194665008673759233,dark november evenings made comfort baking fairytale inspired lemon muffins crammed cream che,november evenings comfort lemon muffins cream che
124,124,1194525060066877440,chaotic colourful home world famous declaration love taj mahal rajasthani city,colourful home world declaration taj rajasthani city
125,125,1194302646989008896,got party planning hat start proceedings elegant lime chilli marinated prawns served,party planning proceedings lime chilli prawns
126,126,1194219301378629632,places better soothe frazzled urban soul poolside crete tranquil minos beach art hotel,places soothe soul tranquil minos hotel
127,127,1193943864693927937,bon anniversaire madame,bon anniversaire madame
128,128,1193940232749625344,punchily dressed sak based marinade miso glazed turbot tastes good looks,sak marinade miso tastes looks
129,129,1193856917359210502,sustainability sexy upping green credentials serves produce farm,sustainability sexy credentials farm
130,130,1193494519246774272,warm sunday morning plate fiery huevos rancheros photography,sunday morning plate fiery huevos rancheros photography
131,131,1193132133134544896,prowling grounds grandiose guests like elizabeth taylor kennedys beaverbrook hotel regain,grounds guests taylor kennedys beaverbrook hotel regain
132,132,1192853066162360321,get filthy food friday chuck dirty butternut fries oven super simple supper,food chuck dirty butternut fries supper
133,133,1192769744585318400,final boarding call flash sale ending november elevate european holiday,boarding call sale holiday
134,134,1192490245956210689,amazing piece thanks helen,piece thanks
135,135,1192407365892689920,warm autumn evenings greek dish sings winter flavours red wine cinnamon cloves,autumn evenings sings winter flavours wine cinnamon cloves
136,136,1192128278976516097,cruised blues raced red runs find finest piste fare new issue one,blues runs piste fare issue
137,137,1192044968027799553,give brunch autumn makeover ben tish burrata burnt orange open sandwich,brunch autumn makeover burrata orange sandwich
138,138,1191682584377470976,driving trips across spain gave nieves barrag mohacho respect food regions homeland te,trips spain nieves respect food regions te
139,139,1191403541073666050,warm winter evenings creamy stuffed butternuts food styling linda,winter evenings butternuts food linda
140,140,1191320196675506176,estonia baltic capital experiencing culinary rebirth generation travellers return home brimming wit,estonia capital rebirth generation travellers home brimming wit
141,141,1190957813746556928,forgo fancy sunday lunch enjoy banquet picnic goods rich slow cooked beef short rib pies add,forgo fancy sunday lunch banquet goods beef rib pies
142,142,1190595415772672000,man elevated spanish national dish paella gastronomic glory comes debut london restaurant,man dish paella glory restaurant
143,143,1190316345256271872,yes know first november christmas around corner get practicing festive feast,yes christmas corner feast
149,149,1190229819642056705,legen,legen
150,150,1190229378187304966,feed peckish party goers deli,feed party goers
151,151,1190229013626785792,issue got fabulously festive platters,issue platters
152,152,1190228081098792960,season festive feasting december issue hits shelves today seasonal recipes inside,season feasting issue shelves today recipes
153,153,1189870643367567360,flying flag mexico fascinating heritage seven moles heady mix artisan producer,flag mexico heritage moles producer
154,154,1189591583668293632,better way traverse stunning landscapes west canadian rocky mountains onboard rocky,way mountains rocky
155,155,1189508252654014464,sweet meets savoury vibrant orange salt cod salad emma,meets orange salt cod salad emma
156,156,1189229202182148097,reader award winners giving chance set sail one european baltic,reader award winners chance baltic
157,157,1189145864335482881,delivering dream crisp chewy ratio sicilian tarongia fried toppings added gr,dream crisp chewy ratio tarongia toppings gr
158,158,1188783477883318272,beautifully proportioned southern italian cuisine tempts stylish clientele evergreen mayfair hotspot fle,cuisine tempts clientele mayfair hotspot fle
159,159,1188421087744479233,perfect coffee crust topped cakes rely best quality eggs plenty patience know,coffee crust cakes quality eggs patience
160,160,1188043611771985921,forget dreaming white christmas dreaming white sands found visa free entry,christmas sands entry
161,161,1187764521240354819,seafood aficionados mingle surfers relaxed portuguese atlantic coast town favourite libo see,seafood aficionados surfers coast town libo see
162,162,1187402137464127488,spin classic spanish eggs robust baby gem lettuce chicory form bed meaty mushro,spin eggs baby gem form bed meaty mushro
163,163,1187039762575712256,says summer still catch precious rays late sun getaways southern europe,summer rays sun getaways europe
164,164,1186677368158597120,make britain apple harvest simple tasty tarts use sweeter apple like braeburn bal,britain apple harvest simple tasty tarts apple braeburn bal
165,165,1186268662539390976,looking get head start magazine journalism looking fabulous editorial intern join us fo,magazine journalism editorial join
166,166,1186231662943899648,quarter century el pirata serving finest tapas dishes side mediterranean fleu,quarter century el pirata tapas dishes fleu
167,167,1185869273052389376,sweeten sunday lunch dessert ambrosial apricots gently cooked spoonfuls honey,lunch apricots honey
168,168,1185506882569605120,unforgettable trip gang eschew standard villas favour something spectacular fleur rolle,trip gang villas something fleur rolle
169,169,1185144498344681472,pleasure playground since twenties paris sea seafood golf boutiques cycling,pleasure playground twenties sea seafood golf boutiques
170,170,1184782111896719360,added bone marrow boost juiciness decadent venison burger topped wild garlic mayo punch,bone marrow boost juiciness decadent venison burger mayo punch
171,171,1184503035562729473,make autumn root harvest rosie birkett flavourful burrata roast root salad,autumn root harvest rosie birkett burrata roast root salad
172,172,1184000711283167238,subtly perfumed air envelops guests arrival evocative lemon groves amp cool marble green tea amp,air guests lemon groves marble tea amp
173,173,1183778254265683969,get enough james martin super simple barbecued lamb chops served chimichurri sauce new pota,james simple chops pota
174,174,1183275936147562496,fresh seafood airy suites mesmerising harbour views cornwall star amp garter country escape,seafood airy views star amp garter country escape
175,175,1183053478148657152,supplement weekend curry jo pratt spring onion carrot bajis dipped zingy green chutney,weekend curry jo pratt spring onion carrot bajis chutney
176,176,1182607787496562688,planos hills find suite bohemian beauty interiors mix hedonism ibiza th,planos hills beauty interiors hedonism ibiza th
177,177,1182328708390166542,get grips warming pilaf packed delicate haddock warming spices ang,grips pilaf haddock spices ang
178,178,1181826385049980929,wed chefs experiencing something culinary renaissance rediscovering skills passed,chefs something renaissance skills
179,179,1181603955408801794,cosy evening comforting white risotto sarah copeland gentl amp hyers,risotto sarah copeland gentl amp hyers
180,180,1181241604515995649,sitting ancient silk road beguiling uzbekistani city offers awe inspiring sights rich cuisine,silk road city offers sights cuisine
181,181,1180956651274289153,whip gregg wallace torta di ricotta treat family classic italian pudding,whip gregg wallace torta di ricotta treat family pudding
182,182,1180433457555607552,spying polar bears artic diving rays fiji find family perfect adventure,bears diving rays family adventure
183,183,1180144753184296960,today latest magazine reveals winners star studded food travel awards pick copy,today magazine reveals winners star food travel awards copy
184,184,1179708686958125057,britain seaside towns enjoying resurgence barely kiss quick hat sight lucy kehoe takes us,britain towns resurgence quick lucy kehoe
185,185,1179429619017093120,go wrong creamy haddock mornay super simple mid week dinner,haddock mornay simple mid week dinner
186,186,1178983905405394945,pack sunscreen swimsuit sandals join us slink european islands basking glorious su,pack swimsuit sandals islands su
187,187,1178704816736030722,enjoy taste california sunshine brilliantly bright courgette pecorino polenta cakes,taste california sunshine courgette pecorino polenta cakes
188,188,1178686230772486145,relive star studded food travel reader awards huge well done winners everyone shortlisted,star food travel reader awards winners everyone
189,189,1178621515845312512,toronto air show city beer week ago canadia largest city week alicia miller,air city beer week canadia city week miller
190,190,1178259129871323136,wow table bringing show stopping cherry frangipane galette sophie hansen,wow table show frangipane galette sophie hansen
191,191,1177896746392915968,chefs relax duty man behind liverpool art school restaurant tells fleur rollet man,chefs duty man school restaurant tells rollet man
