,Unnamed: 0,id,cleaned_word_list,cleaned_word_list_nouns
1384,1384,817355480058236928,transform left satisfying laura santtini co lyhptuiq,transform laura co lyhptuiq
1385,1385,817068672032407556,india always make year finally go seven inspiring ideas,india year ideas
1386,1386,816691317124333572,one support independent retailers like perth excellent,support retailers perth excellent
1387,1387,816238015018389506,want get stuck season best fancy resort away crowds go,get season fancy resort
1388,1388,815937026755362816,escape discover brilliant white sand famous spices ph sarah coghill,escape discover sand spices sarah coghill
1389,1389,815702934960869376,dreams made,dreams
1390,1390,815475390265389056,keep calm cook egg bacon stuffed tomatoes co tbyhwvxdn,calm cook egg bacon tomatoes tbyhwvxdn
1391,1391,815211395952283648,best places world ring find co tdacwm,places world tdacwm
1392,1392,814886527725608960,bring touch sophistication cocktail,sophistication cocktail
1393,1393,814841176503255041,searching perfect give mignonette sauce trout caviar whirl,mignonette sauce caviar whirl
1394,1394,814458533756473344,try decadent take perfect centrepiece celebration meal,centrepiece celebration meal
1395,1395,814124263917678592,nut season think chestnuts roasting open fire walnuts goat cheese,nut season chestnuts fire walnuts cheese
1396,1396,813771503510634499,henry iv ate many one sitting oyster legends secrets click,henry iv legends secrets
1397,1397,813338793306681344,use bones meat whip warming soup stilton toasts,use bones meat whip stilton toasts
1398,1398,813308613456494592,looking back getting us nostalgic trip excellent reading,trip excellent reading
1399,1399,812931563621089280,wishing merry christmas team,merry christmas team
1400,1400,812697056150175744,much know israel food scene jerusalem gourmet traveller fill gaps,food scene jerusalem gourmet traveller fill gaps
1401,1401,812683068486123520,chilli blood orange perfect accompaniment,chilli blood orange accompaniment
1402,1402,812620127539707904,wait make raspberry white chocolate big day tomorrow,wait chocolate day tomorrow
1403,1403,812315738358902786,try upgrading brussels sprouts chorizo almond pangrattato real winner,brussels sprouts almond pangrattato winner
1404,1404,812291717873487873,thanks votes winner read vivid melting pot,thanks votes vivid pot
1405,1405,812251707170320386,feasting fondue experience forget quickly full,experience forget
1406,1406,811967153746411520,love loathe key part proper spread,loathe part spread
1407,1407,811960921505562624,try adding cranberries red cabbage recipe co pvavhqmsj,cranberries cabbage recipe co pvavhqmsj
1408,1408,811953351986450432,wait make roasted guinea fowl rice stuffing mulled wine,wait guinea fowl rice wine
1409,1409,811901671693578240,past twelve months new opened ever discover best,twelve months
1410,1410,811622387661832196,try roasted pomegranate glaze,try pomegranate glaze
1411,1411,811572619694764032,side game saut maple syrup bacon,side game syrup bacon
1412,1412,811563806551851010,tell us want next check back friday guide help discove,check guide help
1413,1413,811535488976830464,lovely made advance relax enjoy morning festivities,advance relax morning festivities
1414,1414,811298997054963712,planning festive handmade british varieties,handmade varieties
1415,1415,811247599340703744,get spirit rustling spiced apple,rustling apple
1416,1416,811228928480309249,excited post traveller guide winning friday,post traveller guide friday
1417,1417,810854969624711168,picking turkey check chef james durrant tips find facebook page,check chef james tips page
1418,1418,810813271498428416,legendary partying tackling thieves scouts youngsters brigade meet,thieves youngsters meet
1419,1419,810506216292098048,roasting sprouts honey shallots bay leaves convert even fussiest eaters,sprouts honey shallots eaters
1420,1420,810445799884804096,ras el hanout grilled lamb bursting moroccan spices almost good eat almost,ras hanout spices eat
1421,1421,810078418192711680,looking got covered sticky fig puddings ginger caramel sauce,puddings ginger caramel sauce
1422,1422,809806154079600640,shaken stirred classic never goes style make according,style
1423,1423,809782905803329536,traditional scottish sweet whisky tablet perfect,sweet tablet perfect
1424,1424,809443381835427840,went learn fine art read full review online,art review online
1425,1425,809435517137907716,rt teamed offer chance win gourmet escape stay https,rt offer chance win gourmet escape stay https
1426,1426,809361177759379457,snorkelling maldives lion fish spearing water wrapped,maldives spearing water
1427,1427,809096988855857152,wait check new especially rowley leigh charge restaurant kitchen january,wait charge restaurant kitchen january
1428,1428,809037896074362880,serious wow factor try hand key lime pie tonight,wow factor try hand lime pie tonight
1429,1429,808726003115757568,buy wine party without reading guide get best value co xczp fxyk,party guide get value co xczp fxyk
1430,1430,808710716781953024,sweeten day slice cheesecake dripping bourbon thanks,day cheesecake bourbon thanks
1431,1431,808680655647342592,need inspiration sides fabulous find,inspiration sides
1432,1432,808349531347816449,easy got top harissa glazed,harissa
1433,1433,807977057489719296,entertaining christmas find ultimate winter co qerr fbogn,christmas winter co qerr fbogn
1434,1434,807902959971532800,thyme scented perfect partner get,thyme partner
1435,1435,807598325373530112,nothing better get spirit snowy plenty,nothing snowy plenty
1436,1436,807517917894033408,bringing best tasting food motherland london italians years,food motherland london italians years
1437,1437,807261370555240448,find ultimate mulled wine facebook page,wine facebook page
1438,1438,807237473415942144,january issue miss tips experts well fa,issue tips experts
1439,1439,807128979983499264,eat san francisco find,eat francisco find
1440,1440,806889920811991040,venice reimagined hans andersen would look something like bruges full story,venice hans something bruges story
1441,1441,806550162034348032,plan break beautiful expect fewer tourists plenty celebrations,plan tourists celebrations
1442,1442,806547742092914689,hi kaya try email get bounce back alternative address use thanks,hi kaya get bounce address use thanks
1443,1443,806532610507894788,sometimes beat really good rump steak shows co fwa ebxszy,rump steak ebxszy
1444,1444,806170231202779136,one word resonates local heading sure stop,word stop
1445,1445,806161384266498048,visit facebook find make perfect bread sauce according jason atherton,visit facebook make bread sauce jason atherton
1446,1446,805806557493600256,women namibia himba tribe wash smoke rather water learn fascinating tribes,women smoke water fascinating tribes
1447,1447,805796631597776896,gives serious upgrade spicy take classic,spicy
1448,1448,805771957794992128,posting festive tips uk top chefs run christmas look hashtag,tips chefs look hashtag
1449,1449,805396521193795585,feast eyes potatoes wrapped parma ham genius,eyes potatoes ham genius
1450,1450,805062866638401536,fruit skillet got written best served evening crackling fir,fruit skillet fir
1451,1451,804981149298806785,looking inspiration try simmone logue corn fritters bacon red pepper jam sour cream,inspiration simmone corn fritters pepper jam cream
1452,1452,804724558930571265,start weekend umami laced geniuses behind bar,weekend umami geniuses bar
1453,1453,804652671076564993,oh darling oh darling find make,find
1454,1454,804364547775676416,hosts one germany biggest markets making perfect time visit,hosts germany markets time visit
1455,1455,804330538970607616,dreaming hot biggest pool mauritius interiors co yyilm,pool mauritius interiors yyilm
1456,1456,804016005768941568,looking something read page guide online,something page online
1457,1457,803662419771977728,planning trip pick smaller town get better value rounded best,trip town value
1458,1458,803294974049665025,molten salted peanut butter mousse tarts ultimate comfort,peanut butter mousse tarts comfort
1459,1459,802884744585170944,comes weekend english countryside cotswolds hard beat,weekend countryside cotswolds
1460,1460,802474606011486208,plan proper pudding tomorrow kirsten tibball trifle guaranteed crowd pleaser,plan tomorrow trifle pleaser
1461,1461,802472018935328769,high level pectin makes ideal jellies lot,level pectin jellies lot
1462,1462,802205264200003584,kick fabulous supper sea trout lemon sauce thanks,sea sauce thanks
1463,1463,802190167066996736,giving away six month subscriptions midnight sorted,month subscriptions
1464,1464,802168786484916224,got great deal click link subscribe save whopping,deal click link subscribe whopping
1465,1465,802157586300764160,know year old date pip recently made sprout israeli researchers learn,year date pip sprout researchers
1466,1466,802129221929881600,follow us instagram unique travel insights beautifully shot seasonal food photos find us,travel insights food photos
1467,1467,801818368407982080,feeling thankful pumpkin custard tarts little cups delight recipe,custard cups recipe
1468,1468,801327037206106112,inspired john lennon mark twain described heaven earth great,john lennon mark twain earth
1469,1469,801093136239968256,chicken goujons smoked paprika mayonnaise pulls bag,chicken goujons mayonnaise pulls
1470,1470,800301470260350976,tamarind glazed well plans sorted thanks inspiration,tamarind plans thanks inspiration
1471,1471,799936551706882048,transform stale bread something beautiful bread butter pudding,bread something butter pudding
1472,1472,799900268041216000,hours kuala lumpur karst crags warren caves glittering quartz marble,hours karst crags warren
1473,1473,799715149909065728,head taste theatre demonstration food travel chef year,head taste demonstration food travel chef year
1474,1474,799636013203292161,planning trip spend afternoon tasting lovely cornish products offer,trip afternoon tasting products
1475,1475,799636007184461824,nothing says like big bad chocolate truffle cake thanks recipe,nothing chocolate truffle thanks
1476,1476,799352765730332672,right come see us taste theatre get signed copy one books,come get books
1477,1477,799318916073811968,may cold diners lounging cashmere sofas linen suits full,diners linen suits
1478,1478,799231952326889472,visit us get signed copy cookbooks,visit copy cookbooks
1479,1479,799210565872717825,plate thanks delicious tarte tatin,plate thanks tarte tatin
1480,1480,798894731002396673,today judging san sebasti expect standout gouda manchego comt res,today standout gouda manchego comt res
1481,1481,798885947530244096,know ring scallop shell represents year growth find secrets,shell year growth secrets
1482,1482,798203971378802688,home made duck spring rolls good bye,home spring rolls bye
1483,1483,798187576867876864,love masala dhal flavour also need one pot thanks,masala flavour pot thanks
1484,1484,798126044351852544,tucked away among gentlemen outfitters st james quintessentially british,outfitters james
1485,1485,797822660180852741,check latest restaurant reviews discover three french gems,check restaurant reviews discover gems
1486,1486,797384735156645888,game tomorrow ultimate roast chicken,game tomorrow roast chicken
1487,1487,797378691386998785,isla holbox streets paved sand hammocks line beaches make next tri,isla holbox streets sand hammocks line beaches tri
1488,1488,797134407530381312,friday night night firing oven make version topped spicy nduja,night night version spicy nduja
1489,1489,797107995717079042,read interview top favourite neighborhood spots eat south london,interview favourite neighborhood spots london
1490,1490,796982103795765248,delve rabat labyrinthine streets never seen,delve rabat streets
1491,1491,796767144939843584,satisfy poached clotted cream pistachio nibs,satisfy cream pistachio nibs
1492,1492,796394945259126789,whether commiserating celebrating kirsten tibballs fudge wheels new best friend,tibballs wheels friend
1493,1493,796344317719834624,spa shaded rainforest perfect place watch flying lemurs full review,spa place watch review
1494,1494,796329189456674816,proves meringues never go season take summer classic,proves meringues season summer classic
1495,1495,796048449691119617,eyes dc get inspired plan trip historic capital guid,eyes plan trip capital guid
1496,1496,796005005119602689,reimagined hans christian andersen would look something like read city guide,hans andersen something city guide
1497,1497,796003197068443649,read writers think maiden voyages sea,writers voyages sea
1498,1498,795672698190000128,feeling chilly beetroot spelt salad warm simple wholesome delicious recipe,spelt simple recipe
1499,1499,795657671940730881,guarantee decadent souffl make monday better thanks,guarantee decadent souffl thanks
1500,1500,795543978519261185,wish starting week mountains around look feature coming soon ph ulf sv,week mountains sv
1501,1501,795200368661721088,today let inspire try caramelised slow cooked lamb never look back,today lamb
1502,1502,794923565124612096,paprika chilli give lovely heat perfect served pint pilsner,chilli pint pilsner
1503,1503,794917631316951041,watching tonight upgrade hot dogs jonas cramby crispy porchetta buns,dogs jonas porchetta buns
1504,1504,794911036050722820,every needs something sticky sweet gingerbread cake caramel figs ticket,something cake caramel figs ticket
1505,1505,794892106632491008,make sure goes bang serve polenta parmesan chips garlic aioli,polenta chips aioli
1506,1506,794529693512900612,top photographer ulf svane location us capturing beauty sacred valley watch,photographer svane location beauty valley watch
1507,1507,794158562272571392,every angeleno claims know best find one favourite,angeleno claims favourite
1508,1508,794138368716181504,celebrate beauty biscuits bacon lathered red eye gravy thanks,celebrate beauty biscuits bacon eye gravy thanks
1509,1509,793475481526042624,kind menu want revisit taste everything full review,kind menu revisit taste everything review
1510,1510,793356958036324353,see flavoursome vegan dishes top recipe nasi lemak,dishes recipe nasi lemak
1511,1511,793166326261055490,tender pulled lamb swoop pureed pumpkin match made heaven co jxol ycbs,tender swoop match co jxol ycbs
1512,1512,793128265791791104,side game spiced pumpkin lentils click recipe,side game lentils recipe
1513,1513,793103916862959616,issue shelves essential tips,issue tips
1514,1514,793082864212533249,try warming pumpkin chanterelle risotto lunch co vuidzlhedq,chanterelle risotto lunch co vuidzlhedq
1515,1515,793045219541393409,pumpkin donuts coffee anyone michael rantissi kristy frawley,pumpkin donuts anyone michael frawley
1516,1516,793007252340895745,many ways use pumpkins carving posting recipes throughout today keep checking back,ways pumpkins recipes today checking
1517,1517,792750597112029184,colombo tuk tuk drivers sarah coghill,colombo tuk tuk drivers coghill
1518,1518,792365867006889984,know oscar wilde son started first sardine tasting club london find,oscar wilde son london find
1519,1519,792013545634467840,thanks friday delivery crepes satisying elasticity salty caramel sauce divine,thanks delivery crepes elasticity salty caramel divine
1520,1520,791950342577545216,planning smokes salmon site add fluffy scrambled eggs,smokes site add fluffy eggs
1521,1521,791927846373425152,rt innovative campaign amp content award finalists,rt campaign award finalists
1522,1522,791648407337181185,white beans chorizo secret ingredients transform stew try recipe,beans ingredients try recipe
1523,1523,791610892236558336,spotlight really august crowds left explore leisurely pace,spotlight crowds pace
1524,1524,791316180262907904,need something warming delicious help try spicy meatballs caroline eden eleanor ford,need something help spicy meatballs eleanor ford
1525,1525,791301243822047232,make european holiday find best trips mushrooming olive picking,holiday trips picking
1526,1526,790956132269453312,get inspired make lovely vermicelli squid clams pasta master,get squid clams master
1527,1527,790948738214858752,three michelin starred eat home town use tips next trip,michelin home town use tips trip
1528,1528,790569325493096448,going let secret home infusions incredibly simple look wonderfu,let home infusions look wonderfu
1529,1529,790519559166058497,nothing like good keep warm cold monday evening one three types,nothing cold monday types
1530,1530,790168572697935872,best seafood chefs south west ask,seafood chefs ask
1531,1531,790119388863139840,try tender fennel lemon serve focaccia mop juices,tender fennel lemon focaccia mop juices
1532,1532,789829193701863425,discover culinary capital oaxaca feast authentic mole dishes ph,capital oaxaca mole dishes
1533,1533,789485324544212992,celebrate weekend decadent tart topped raspberries thanks,celebrate weekend tart raspberries thanks
1534,1534,789124155727904768,temperatures still mid glamorous blast need right,temperatures blast need right
1535,1535,789096470481862656,hi thanks pointing correct version happy cooking,thanks version cooking
1536,1536,788990802131316736,get planning next holiday every room sea views review,holiday room sea views review
1537,1537,788711827337252864,give mushrooms toast food travel treatment add burdoch danish rye bread thanks michelle mckenzie,mushrooms food travel treatment rye bread thanks mckenzie
1538,1538,788684986119495681,eating brings best vegetables month healthy delicious,brings vegetables month
1539,1539,788356816283500544,considering break brewery smokehouse farm full,brewery smokehouse farm
1540,1540,788326327703236608,thoroughly enjoyed final pellegrino young chef congrats winner mitch lienhard michelin starred,pellegrino chef congrats lienhard michelin
1541,1541,788035807198273536,transport northern recipe creamy cuajada topped honey walnuts,transport recipe creamy cuajada honey walnuts
1542,1542,787596515934081025,true cooking style bit like sex life read full interview,cooking style bit sex life interview
1543,1543,787390294056665088,whip delicious corn fritters crispy bacon red pepper jam today thanks,whip corn fritters bacon pepper jam today thanks
1544,1544,786967697225576449,give bourbon peanut butter creme brulee go requires five ingredient,bourbon peanut butter creme brulee ingredient
1545,1545,786956172779724800,quick supper baked peppers tomatoes fiery chorizo divine,supper peppers tomatoes divine
1546,1546,786902349763768320,come see us stand offering great deals new subscribers including free cookery book,deals subscribers cookery book
1547,1547,786605256176242688,cold weather calls braised chicken thighs fig leaves white bean puree,weather chicken leaves puree
1548,1548,786461693136269312,pack bags arrived first read guide best steaks city,pack bags guide steaks city
1549,1549,786216269276147712,need escapism discover solitude style scenery world stunning wilderness retreats,need escapism style scenery world wilderness retreats
1550,1550,786175225482375168,came uneducated background gift cooking read full interview,background gift interview
1551,1551,785880282737979393,like two tickets chocolate show weekend subscribe today,tickets show weekend subscribe today
1552,1552,785821130477142016,heading miss meal food comes owner far,meal food owner
1553,1553,785366938285436928,make morning little sweeter delicate quince jelly perfect home made bread recipe,morning sweeter delicate quince home bread recipe
1554,1554,785064941535584257,season hunt countryside bedding elegant,season hunt countryside bedding elegant
1555,1555,785019634617610240,spend co zzenkbswfa,co zzenkbswfa
1556,1556,784686066334851072,uk great supply restaurants rooms perfect gourmet favourite,supply restaurants rooms favourite
1557,1557,784414338727735296,real kudos whip stuffed spatchcocks lamb pine nuts michael rantissi,kudos spatchcocks pine nuts rantissi
1558,1558,784279769743450112,looking inspiration try ireland lyrical port city,inspiration try port city
1559,1559,784072239893405696,time plan trip temperatures start climb,time plan trip temperatures climb
1560,1560,783970445011943424,clock pretzel caramel bars perfect blend salty sweet love aimee twigger decoration,clock pretzel caramel bars salty love aimee twigger decoration
1561,1561,783708455697780736,said summer tonight making beetroot lentils goat curd,summer tonight beetroot lentils curd
1562,1562,783637964635136004,whether move eating al desko beat great sandwich click ultimate recipe,move al desko click recipe
1563,1563,783336743831531520,one favourite athens take look interiors see,favourite athens look interiors
1564,1564,782920724637941760,congratulations pick issue full inter,congratulations issue inter
1565,1565,782498031186894848,looking inspiration take stroll market pay visit,inspiration stroll market visit
1566,1566,782226398987620353,secret ingredient devilishly delicious frozen tiramisu cheesecake,ingredient frozen tiramisu
1567,1567,781893965796806657,issue finally cracker free south australia supplement essential,issue south supplement
1568,1568,781743021381517312,visit wawel castle followed stroll along river one favourite activities,visit wawel castle stroll river favourite activities
1569,1569,781282616146268162,looking light try fig tuna carpaccio finished squeeze orange juice,try fig tuna carpaccio squeeze orange juice
1570,1570,780810525970206720,one prettiest infinity read full,infinity
1571,1571,780711677146832896,rt thanks sponsors aa restaurant year awards london,thanks sponsors year awards
1572,1572,780444403903111168,want get money holiday click six fantastic money saving,get money holiday money
1573,1573,779606509449797632,meet chef year voted food travel reader awards,meet chef year food travel reader awards
1574,1574,778964771475447808,spontaneous book trip expect sweeping beaches speckled cows soft cheesesh,book trip beaches cows cheesesh
1575,1575,778632465598541824,learn incredible natural larder gourmet traveller,learn larder gourmet traveller
1576,1576,777797181105373184,spot year awards video co nlbhmc,spot year awards co nlbhmc
1577,1577,777424554759221248,discover scilly isles breakfast co jdwddd ryp,breakfast co jdwddd ryp
1578,1578,777092349419745280,bramble fool makes end feeling little sweeter co setpd wk,fool co setpd wk
1579,1579,776041492229918720,stay cool hottest september century salty caramel ice cream,stay century salty caramel ice cream
1580,1580,775456219913920512,thanks everyone made special readers voted royal automobile club course guests,thanks everyone readers royal automobile club course guests
1581,1581,775455862441869312,winner chef year one congratulations sir,winner chef year congratulations
1582,1582,775455639053238272,breakthrough chef year rising star,breakthrough chef year star
1583,1583,775455237440212992,delighted reveal destination year wonderful spain congratulations,reveal destination year spain congratulations
1584,1584,775454253032833028,big shout home city london deserving winner city year,shout home city winner city year
1585,1585,775453790656991236,bar year drink,bar year drink
1586,1586,775445712066732032,yuzu white chocolate aero pudding,chocolate aero pudding
1587,1587,775441980809674753,reveal overall winner restaurant year well deserved,winner restaurant year
1588,1588,775441620342833152,congratulations celebrating th birthday year true timeless classic,congratulations th year timeless
1589,1589,775441173385273344,massive congratulations london restaurant year voted readers,congratulations year readers
1590,1590,775440709960790017,official outside london restaurant year wedgwood restaurant congrats,london year wedgwood restaurant congrats
1591,1591,775440371706986496,delighted announce newcomer restaurant well deserved,announce newcomer restaurant
1592,1592,775439976691556352,hotel year goes huge congratulations,hotel year congratulations
1593,1593,775439664756981764,readers voted mauritius best international hotel year,readers mauritius hotel year
1594,1594,775439320438149120,beautiful rural hotel year massive congratulations,hotel year congratulations
1595,1595,775438838374301696,gourmet bolthole year another food travel award,gourmet bolthole year food travel award
1596,1596,775438618936614912,reveal city hotel year,city hotel year
1597,1597,775438172738256896,bed breakfast year goes impeccable food lovely boutique rooms,bed breakfast year food boutique rooms
1598,1598,775437152305938432,congratulations ocean cruise line year,congratulations cruise line year
1599,1599,775436614529085440,main tender rack lamb saffron onions bulgar piquillos created le gavroche executed rachel humphries,tender rack lamb saffron onions le gavroche humphries
1600,1600,775421695704363008,book year venice istanbul indomitable,book year venice istanbul
1601,1601,775421349057720321,cookery school year michel roux jr cookery school another award,cookery school year michel roux jr cookery school award
1602,1602,775420655563108353,delighted reveal purveyors things delicious specialist retailer year,reveal purveyors things specialist retailer year
1603,1603,775412910461976576,start jersey squid risotto,start jersey squid risotto
1604,1604,775408308790460417,overall cruise line year goes,cruise line year
1605,1605,775408085422645248,boutique cruise line year goes,boutique cruise line year
1606,1606,775407661709946880,well done readers named river cruise line year,readers river cruise line year
1607,1607,775407285774458881,officially get enough long haul airline year third time row,airline year time row
1608,1608,775407055532359681,short haul airline year love extra leg room excellent service,haul airline year leg room service
1609,1609,775406706394300416,massive year latin america tour operator year congratulations,year latin tour operator year congratulations
1610,1610,775382977433968640,stage set going fabulous night,stage night
