,Unnamed: 0,id,cleaned_word_list,cleaned_word_list_nouns
2087,2087,653601375809576960,posting curry recipe everyday week celebrate,curry recipe week celebrate
2088,2088,653163646768562176,spiced persian recipe proves turkey christmas,recipe christmas
2089,2089,652869142635249668,tempranillo natural tapas pairing much versatile wine,tapas wine
2090,2090,652793472555085824,still time get free tickets family travel show oct nov email kelly satchell com,time tickets family show email com
2091,2091,652524136892399616,cocktail lovers old fashioned banana liqueur amp nut syrup dashes angostura bitters,cocktail lovers liqueur amp nut syrup dashes bitters
2092,2092,652498334888935424,pultney bridge looking dazzling find full program,pultney bridge program
2093,2093,652423368008986625,artesian taking world best bar th year spin,world bar th year spin
2094,2094,652159667250950144,kale crisps cashew chilli salt ultimate nibble,kale crisps cashew chilli salt
2095,2095,652159160839094272,claim free tickets family travel show london oct nov emailing kelly satchell com,claim tickets family travel show com
2096,2096,652061445157470208,independent manchester beer convention starts today world best breweries gathered one roof,manchester beer convention today world breweries roof
2097,2097,651790064524075008,sweet like tuk tuks tropical heat tea estates stole hearts,sweet tuk tuks heat tea hearts
2098,2098,651778214344458240,still time get tickets glasgow weekend looking forward meeting,time tickets weekend meeting
2099,2099,651777719420780545,rt thank much looking forward lovely meal,thank
2100,2100,651442595835609088,simple korean spring onion pancakes add kick tuesday night,spring onion pancakes tuesday night
2101,2101,651380953781243904,congrats winner competition dinner night,congrats competition dinner night
2102,2102,651366831761002497,restaurants top world better time visit,restaurants world time visit
2103,2103,651356482383032320,rt top tip november issue miss scottish lobster season htt,rt tip issue lobster season htt
2104,2104,651064438716542976,remote beautiful little eccentric alaska everyone bucket list co aueboddvok,alaska everyone bucket list co aueboddvok
2105,2105,650596598645424128,take classic pavlova perfect end co jwi hzqcho,pavlova end co jwi hzqcho
2106,2106,649916919588495360,spontaneous trip suffolk think beach walks cosy pubs fresh fish ow ly svark,trip suffolk beach walks pubs ow ly svark
2107,2107,649901694575341568,fabulous editorial internship opportunity uk amp german editions starting next week blossom com,editorial internship opportunity editions week blossom com
2108,2108,649868935802814465,rt oh bappy days bun fights wow baos popup,rt days fights baos popup
2109,2109,649635093351411713,october nationaltomatomonth celebrate colourful gurnard dish co zw dyooaen,celebrate dish co zw dyooaen
2110,2110,649586372030918657,flavoursome vegetable curries ensure celebrate style,flavoursome curries celebrate style
2111,2111,649148520683933696,really interested working get touch please email lizzie frainier com urgently,please email lizzie com
2112,2112,648890747371016193,getting fix hot coffee chestnut sauce,coffee chestnut sauce
2113,2113,648786997893570560,rt travel media innovative campaign content year spanish tourist office,rt travel media campaign year tourist office
2114,2114,648548572141592576,fall love coastal towns big meaty flavours,fall love coastal towns meaty flavours
2115,2115,648158005842837504,honey fig walnut goes well tea loaf ideal,honey fig walnut loaf ideal
2116,2116,647737509917642752,curried pickled onions add fragrant kick rib beef,onions rib beef
2117,2117,647071825374117889,mark jordan eulogizing natural larder,mark jordan larder
2118,2118,647008880615145472,delighted shortlisted consumer travel publication year travel media awards,consumer travel publication year travel media awards
2119,2119,646714083761369089,win night stay abbey hotel day foraging luxury hamper co ckhrkcen,night hotel day luxury hamper co ckhrkcen
2120,2120,646655459861090304,finn good know little better,
2121,2121,646353722658975744,evening bike ride indonesia anyone mark parren taylor,bike ride anyone mark parren taylor
2122,2122,646274049430167552,master art fish preparation overlooking tyrrhenian sea,master art preparation sea
2123,2123,646255848273133568,rt straw hat anyone canoa ecuador,rt anyone canoa ecuador
2124,2124,645983668536766465,transform yesterday roast warming chicken salad,transform yesterday chicken salad
2125,2125,645883962531950592,rt bravo chef well balanced trophies one looking dish dressed bedlam,rt bravo chef trophies dish bedlam
2126,2126,645508119209115648,heading farmer market morning veg stall normandy blew us away,farmer market morning veg stall
2127,2127,645160981002354688,get involved spiced carrot recipe,carrot recipe
2128,2128,644919586379464704,revealed cocktail gin st germain yuzu lychee blend lime green oolong tea,cocktail gin st germain yuzu blend lime tea
2129,2129,644798524811554817,heading remember check food festival,food festival
2130,2130,644792806767230976,rt sight come back well done great team effort,rt team effort
2131,2131,644549778232209408,head facebook page check photos year reader awards,head facebook page check photos year reader awards
2132,2132,644541824053420032,click see five favourite unsung hotels se asia,click unsung hotels asia
2133,2133,643801648675037185,thanks brands sent treats goodie bags,thanks brands treats bags
2134,2134,643783330853486592,delighted sneak preview year christmas range thanks making tuesday little sweeter,sneak preview year christmas range thanks sweeter
2135,2135,643731184678252544,round fabulous winners,round winners
2136,2136,643726891590004736,rt big thank fabulous evening voted,rt thank evening
2137,2137,643547457817718784,thanks everyone made tonight special afterparty,thanks everyone afterparty
2138,2138,643546968564875265,restaurant year goes indomitable,year
2139,2139,643546499973050369,best london restaurant congratulations,london restaurant congratulations
2140,2140,643546245991112704,worthy winner timeless classic many,winner timeless
2141,2141,643545740875333637,uk best restaurant year outside london,year london
2142,2142,643545491851091968,best new restaurant year none congratulations,year none congratulations
2143,2143,643545046076235776,prestigious award night top chef goes,award night top chef
2144,2144,643544829876674560,deserving winner breakthrough chef year future looking bright,winner chef year future
2145,2145,643534498160840704,decadence plate double choc brownie salted caramel little salty popcorn looks delicious,decadence plate choc brownie salty
2146,2146,643532202882564096,congratulations destination year two years running well deserved,congratulations year years
2147,2147,643531860782522370,city year goes enchanting edinburgh historic stylish oh atmospheric,city year oh atmospheric
2148,2148,643531483165143044,best bar year goes drink,bar year
2149,2149,643531146651955200,well done winner best rural hotel hotel year congratulations,winner hotel hotel year congratulations
2150,2150,643530787913121792,best hotel world according readers,hotel world readers
2151,2151,643530420764733442,gourmet bolthole year,gourmet bolthole year
2152,2152,643530203449442304,congratulations city hotel,congratulations city hotel
2153,2153,643529859927572480,bed breakfast year intimate luxurious,bed year
2154,2154,643515745952002049,salt marsh lamb split pea falafel miso caramel cardamom yoghurt,salt marsh lamb split pea falafel miso caramel cardamom yoghurt
2155,2155,643512031430201344,best cook book sensual feast persiana,cook book feast persiana
2156,2156,643511094452076544,congratulations cookery school year,congratulations school year
2157,2157,643510698622984192,specialist retailer year none congratulations,specialist retailer year none congratulations
2158,2158,643502852116250630,beautiful sea bream ceviche starters,sea bream ceviche starters
2159,2159,643500241409474560,looking forward meal three sensational chefs,chefs
2160,2160,643499460199378944,congratulations river cruise year overall winner cruise line year,congratulations river year winner cruise line year
2161,2161,643498919985565697,best ocean cruise line fandtawards,cruise line fandtawards
2162,2162,643498704410923008,well done adventure cruise line year,adventure cruise line year
2163,2163,643498379021041664,long haul airline congratulations,airline congratulations
2164,2164,643498158711001088,congratulations short haul airline,congratulations haul airline
2165,2165,643497950107275264,first award night tour operator year,night tour operator year
2166,2166,643494573222793216,stage set,stage set
2167,2167,643382059474530304,rt good luck everyone reader awards tonight look evoo goody bag,rt luck everyone reader awards look evoo goody bag
2168,2168,643343419474092032,rt dusting glad rags reader awards tomorrow wait see,rt rags awards tomorrow see
2169,2169,643001649783513088,classy tart perfect way round first autumn,tart way round autumn
2170,2170,642669691840950272,hearty salad lunchtime,hearty salad lunchtime
2171,2171,642368094049071104,everything ever wondered matching syrah game,everything game
2172,2172,642291608138985473,congratulations winner message us address facebook game winging way asap,congratulations game way asap
2173,2173,642005602273755136,found seoul south korea vibrant capital weekend,seoul capital weekend
2174,2174,641995907039424512,win game seen current issue simply retweet post announce winner noon tomorrow,game issue post announce winner noon tomorrow
2175,2175,641945009047109632,countries inspired nuno mendes asked,countries mendes
2176,2176,641643181516419072,london rugby world cup stay boutique hotel little amp match,london rugby world cup hotel match
2177,2177,641265056232157184,autumn may coming san sebastian surf sun shining mowie kay,autumn surf sun mowie kay
2178,2178,641225784766656512,reveal official awards party held sketch tickets email kelly satchell com,awards party tickets com
2179,2179,641220149790572544,get tickets birmingham manchester amp glasgow cruise shows book quoting code co fbhacghkw,tickets manchester amp glasgow cruise book code co fbhacghkw
2180,2180,640449810567438337,treehouses gypsy caravans luxury prison uk eccentric hotels,treehouses caravans prison hotels
2181,2181,640434719419723776,herb infused honey toast morning,herb honey toast morning
2182,2182,640102570975956993,figs bang season everything need know september finest fruit,figs season everything need fruit
2183,2183,639823339528278016,looking fish fix crispy prawns thing evening,fix crispy prawns thing evening
2184,2184,639770445860966400,vote top rural hotel,vote hotel
2185,2185,639694702502105088,best amp,amp
2186,2186,639475610864193536,best chef decide co rvvyw kv brett graham,chef rvvyw kv brett graham
2187,2187,639475610469957632,top chef say,chef
2188,2188,639460562905243648,announced fat duck reopens sept tasting menus get quick,duck menus get
2189,2189,639442761926733824,tour operator decide,tour operator decide
2190,2190,639442672256688128,vote favourite tour operator,vote operator
2191,2191,639092626122231808,head spitalfields market tomorrow friday celebrate milan offer,head spitalfields market tomorrow celebrate milan
2192,2192,639011877373255684,ready,
2193,2193,639000008348553216,rt morning morning full chocolate hosting chocolate tasting team,rt morning morning chocolate chocolate tasting team
2194,2194,638777196467888130,best bar,bar
2195,2195,638773570022309888,best bar,bar
2196,2196,638762633089404928,hottest new restaurant,restaurant
2197,2197,638762632699342848,hottest new restaurant call,restaurant call
2198,2198,638754517132120064,timeless classics gets vote,timeless classics vote
2199,2199,638754516830134272,timeless classics choose say,timeless classics
2200,2200,638746994090094592,best restaurant outside london,restaurant london
2201,2201,638736078539759616,london best restaurant,london restaurant
2202,2202,638124526564470789,toast vegetable patch copa portobello gin tonic carrot juice berries,toast patch copa portobello gin carrot juice berries
2203,2203,637939215968403456,ever tire salted caramel nope simple tart pudding,tire tart pudding
2204,2204,637656887580884992,south american wine malbec,wine malbec
2205,2205,637550719474774016,nobu san eat duty find,eat duty
2206,2206,637354545534910465,read exclusive interview tonight show,interview tonight show
2207,2207,637203499076448256,feeling little peckish crab apple leathers hit spot,crab apple leathers spot
2208,2208,637188336726224896,one week left vote get voting,week vote get voting
2209,2209,636961757093863424,fancies star trip mexico including tickets latin america best restaurant awards,fancies trip mexico tickets restaurant awards
2210,2210,636886185781121024,try luscious beef burger seasoned lovage served focaccia,beef burger lovage focaccia
2211,2211,636870981118783488,spiced veggie burgers kick,burgers
2212,2212,636863359682527232,bank holiday sight two favourite recipes follow,bank holiday recipes
2213,2213,636539330358571008,europe best beaches fine dining boundless sunshine,europe beaches boundless sunshine
2214,2214,636206575963774976,long walk home transylvania bram stoker eat heart literally mowie kay,walk home transylvania bram stoker heart kay
2215,2215,636201412385488896,millennia old history discover,millennia history discover
2216,2216,636099825138855936,rt enjoying sunshine amp,rt sunshine amp
2217,2217,636099773058162688,rt fabulous find harrogate enjoying read brekkie happy sunday,brekkie sunday
2218,2218,635135065270419457,saturday night curry regional guide india favourite flavours,night guide india favourite flavours
2219,2219,635112078014087168,gluten free cookery school handing health tips samples stall day tomorrow,gluten cookery school health tips samples day tomorrow
2220,2220,634818026999836672,joined york cookery school tomorrow classes new subscribers,york cookery school tomorrow subscribers
2221,2221,634757882098098177,calamari sweetcorn furikake hard hitting flavour beautifully crisp,calamari sweetcorn flavour
2222,2222,634741930736418816,issue sale today packed juicy recipes far flung places feed wonderlust,issue sale today juicy recipes places wonderlust
2223,2223,634394799886454784,great choice weekend away,choice weekend
2224,2224,634379922874703877,roll roll park cookery school joining us tomorrow see,roll roll park cookery school tomorrow
2225,2225,634311263309418496,looking fabulous editorial intern join us september ideally german speaker send cv blossom com,editorial join speaker cv blossom com
2226,2226,634032575762309120,ciociaria exceptional food landscapes yet remains one italy best kept secrets,ciociaria food landscapes italy secrets
2227,2227,633639763132719104,catching old friend downtown la paz gary latham,friend downtown latham
2228,2228,633549055977783296,subscribers invited join us free weekend message us put guest list,subscribers join weekend message list
2229,2229,633322793225035776,talks ducks waffles goes find edible inspiration,talks ducks waffles inspiration
2230,2230,633309975490785280,heading harrogate weekend join us free friday message us email send ticket,harrogate weekend message ticket
2231,2231,632975467700748288,jesuit bark julep clove pimento lime grapefruit peel quinine cordial mint,jesuit bark julep pimento lime grapefruit peel mint
2232,2232,632930140150960128,maid cuba lime sugar syrup cucumber mint absinthe soda,maid cuba lime sugar cucumber mint absinthe soda
2233,2233,632907274126815232,tahiki punch amp heavy rums pineapple sherbet lime bitters palm sugar,tahiki punch rums sherbet lime bitters sugar
2234,2234,632877063834337280,north beach coconut cream coconut water elderflower lime amp lemon,beach coconut cream coconut water elderflower lime amp lemon
2235,2235,632839380349120514,celebrate posting favourite rum based cocktail recipes drink,celebrate rum cocktail recipes
2236,2236,632597829794562049,eating keep eyes peeled interesting greek wines,eyes wines
2237,2237,632477011102072832,chill tart plum sorbet,plum sorbet
2238,2238,631858425698369536,last minute trip seaside,minute trip seaside
2239,2239,631435046918955008,wonders inspired unesco world heritage sites,wonders world heritage sites
2240,2240,631133286425882625,spot fishing nelson new zealand ewen bell,spot zealand ewen bell
2241,2241,631118478301392896,celebrate wonderfully simple strawberry cream whirls,celebrate strawberry cream whirls
2242,2242,630302760928452608,sundays long lazy breakfasts try french toast berry sauce,sundays breakfasts toast berry sauce
2243,2243,630288725608669184,new town cookery school handing tempting morsels cooking tips stall today come say hi,town school morsels tips today hi
2244,2244,630038425127768064,entertaining tonight ditch chardonnay stigma top pours,ditch chardonnay stigma top pours
2245,2245,629970681288114176,share post come say hi receive free copy magazine subscribe little,share post hi copy magazine subscribe
2246,2246,629925321324765184,today joined krua thai cookery school demonstrating fruit carving class new subscribers,today thai cookery school fruit class subscribers
2247,2247,629691302721003520,get fish fix bbq chorizo prawn skewers,fix bbq chorizo prawn skewers
2248,2248,629668463443881984,new subscribers foodies festival entered draw win cooking class edinburgh new town cookery school,subscribers foodies win class town cookery school
2249,2249,629602371790880768,got loads surprises giveaways lined edinburgh foodies fest weekend,loads surprises giveaways foodies weekend
2250,2250,629331224306262016,weekend away pals best exclusive use properties uk,weekend pals use properties
2251,2251,628959027825876992,feed humpday daydreams guide world peaceful island escapes,feed daydreams world peaceful island escapes
2252,2252,628947358332682241,beauties fresh boat normandy sarah coghill,beauties boat sarah coghill
2253,2253,628596866394005508,hiking sunrise crete gary latham,sunrise crete latham
2254,2254,627864092221509633,nothing says afternoon tea like smell freshly baked biscuits,nothing afternoon tea smell biscuits
2255,2255,627539524671918080,party like peru zingy pisco sours,party peru zingy pisco sours
2256,2256,627162155335479296,bluffer guide wine pairing impress friends,bluffer wine friends
2257,2257,627147228654772224,sophisticated lollies add light hearted touch occasion,lollies occasion
2258,2258,627011063150694404,fancies starting hot butter drenched toast plum jam,fancies butter jam
2259,2259,626792138630672385,spend weekend labyrinth history right tarn river,weekend history right tarn river
2260,2260,626742356012871680,happy national cheesecake day oodles recipes website,cheesecake day recipes website
2261,2261,626730138072412160,enjoy daiquiri hemingway havana changes forever,enjoy changes
2262,2262,626429809774723072,inspired world magnificent cave hotels,world magnificent hotels
2263,2263,626286140870533120,escape rush hour presenting brand new guide island life,escape hour brand guide island life
2264,2264,626070941207015424,one bucket list day deserted beach cook islands,bucket list day beach cook islands
2265,2265,625251894156468225,side game sunday fresh zingy take roast veg,side game zingy roast veg
2266,2266,625010367320719360,fabulous iced tea cocktails drink,tea cocktails
2267,2267,624625727602868224,fish mushy peas food travel way,mushy peas food travel way
2268,2268,624253701578997760,time start thinking sundowner top negroni comes highly recommended,time negroni
2269,2269,624248244034478080,escape poland weekend,escape poland weekend
2270,2270,623885872992227328,favourite long haul beach destinations,beach destinations
2271,2271,623764833448644608,road trip cape town anyone roderick field,road trip cape town anyone field
2272,2272,623153236694958081,start week umami heavy parma ham pear pea shoot salad,start week parma ham shoot salad
2273,2273,621722338833395713,celebrating duck cherry tarragon salad hazlenuts,duck cherry tarragon salad hazlenuts
2274,2274,621356504092909570,leave prague amsterdam paris crowds alternative guide europe,prague guide europe
2275,2275,621267393134915584,rt featured month check,rt month check
2276,2276,621224004221829120,meringues grilled peaches toffee sauce presenting aug sep cover,meringues peaches toffee aug sep cover
2277,2277,620993789138739200,room view jade mountain resort st lucia,room view jade mountain resort st lucia
2278,2278,620933878593757185,happy people celebrate pierre herm one world finest patissiers,people world finest patissiers
2279,2279,620878637923987456,rt cooked teriyaki salmon dinner delicious thanks recipe,rt salmon dinner thanks
2280,2280,620515086403248128,rt fab article best uk travelling hedonists mag magnificent incomparable,rt fab article hedonists magnificent
2281,2281,620172055636520962,shake sunday seafood paella chunks chorizo,shake sunday chunks
2282,2282,619929486541369344,chocolate vodka say,chocolate vodka
2283,2283,619559433719427072,fish semillon ideal alongside,semillon ideal
2284,2284,619522133417459713,delicate coffee vanilla hint salt perfect afternoon pick,coffee vanilla hint salt afternoon pick
2285,2285,619477596183621632,august september issue sale today grab copy,september issue sale today copy
2286,2286,619191957726883844,spend laid back weekend sea st helier,spend weekend sea st helier
2287,2287,619083802275639296,celebrate ice cream tea,celebrate ice cream tea
2288,2288,618819579897335808,lonely sand flanked azure water tropical trees pacific forgotten islands co dcczy,sand water trees islands dcczy
2289,2289,618707786466230272,check brand new instagram account,check brand instagram account
2290,2290,618464940534427648,day dreaming turquoise coast turkey,day turquoise coast turkey
2291,2291,618383379608772608,raspberries best right use puddings drop glass fizz,raspberries use puddings drop glass fizz
2292,2292,618057067727818752,send ideas info com make sure passed right person thanks,ideas com person thanks
2293,2293,617986030323560448,rt thrilled featured months mag,rt months mag
2294,2294,617468249089908736,pretty ice hearts sugared almonds little taste heaven,ice hearts almonds taste heaven
2295,2295,617396304726093824,quaffing strawberry mint juleps celebrate first week well played,strawberry mint juleps week
2296,2296,617256869921443840,sibton park looking sensational morning,sibton park morning
2297,2297,617015531644841984,relax salmon goat cheese ravioli watercress pesto,relax salmon goat cheese ravioli watercress pesto
2298,2298,616913619880660993,new foodies festival alexandra palace weekend get tickets code foodies,foodies palace weekend tickets foodies
2299,2299,616910608387149824,getting serious wanderlust envy vietnamese adventures,wanderlust envy adventures
2300,2300,616653964516438016,street feast little sister launching shepherd bush yard tonight see,street bush yard see
2301,2301,616643862254194688,fancy last minute guide,fancy minute guide
2302,2302,616275289623134208,take walk wild side adventure holidays,walk side adventure holidays
2303,2303,616263194730983424,beat heat iced fruit lassi,beat heat fruit lassi
2304,2304,616262319186812929,rt perfect summer swims,rt summer swims
2305,2305,615550619726839808,transform yesterday chicken refreshing soup infused dill,transform yesterday soup dill
2306,2306,615524004703678466,rt delicious cr br flat white good read perfect saturday treat http,cr br read perfect treat http
2307,2307,615099901958057985,summery take lamb,summery lamb
2308,2308,614826845192724480,cooking seafood insider tips wine drink alongside,seafood insider tips
2309,2309,614479654292987904,tandoori prawns ease,tandoori prawns ease
2310,2310,614448675704696834,thoroughly enjoyed preview outpost last night,preview outpost night
2311,2311,614146419751038976,great trip,trip
2312,2312,614093695151927296,escape weekend weather perfect june,escape weekend weather june
2313,2313,613376632447963136,im restaurant rome good enough grace kelly karl lagerfeld,im restaurant rome grace lagerfeld
2314,2314,612994445764632576,rt thank guys great interview latest edition mentions great job,rt thank guys interview edition mentions job
2315,2315,612953540470943744,transform yesterday lamb fragrant soup,transform yesterday soup
2316,2316,612545760870203392,ultimate sunday dessert crunchy creamy decadent,sunday dessert crunchy decadent
2317,2317,612322869398360064,toast night refreshing mint tea cocktail,toast night mint tea cocktail
2318,2318,612274060127563776,last minute sday gift subscription food travel magazine whole year,minute gift subscription food magazine year
2319,2319,611957961448116224,happy bonds training amp loves plymouth gin noilly prat twist making,bonds amp loves twist making
2320,2320,611926729872031745,cheesy weekend indulgence wont find local burger vendor,cheesy weekend indulgence burger vendor
2322,2322,611571748870467587,spend sea valletta,sea valletta
2323,2323,611552587674947586,sun shining celebrate making goat cheese cigars,sun celebrate making goat cheese cigars
2324,2324,611473634528501760,seduced itel gourmet break,itel break
2325,2325,611217232262246401,subscribers could retweeting last message postcode,subscribers message postcode
2326,2326,611194261900521472,clean air crystal waters jaw dropping scenery world picturesque lakes,air waters scenery world picturesque lakes
2327,2327,611168278573133824,subscribers competition win vip tickets taste london retweet postcode subscriber,subscribers competition tickets retweet postcode
2328,2328,611159450834063360,rt santa barbara guide july nostalgic write indeed,rt santa barbara guide july
2329,2329,610858094583803906,facebook message us get free tickets us,facebook message tickets
2330,2330,610857548657356800,winner competition,winner competition
