,Unnamed: 0,id,cleaned_word_list,cleaned_word_list_nouns
688,688,1064304939189641217,furreal pets every kid want christmas plus buy,pets kid christmas
689,689,1064287342704410624,fingerlings hatchimals surprise check christmas toys want amazon,fingerlings hatchimals christmas toys amazon
690,690,1064274001839759368,extra cranky baby could showing teething symptoms learn look find best teething remedi,cranky baby symptoms teething remedi
691,691,1064247196994949120,educational video games kids ages help little ones build usable skills like math histor,video games kids ages ones skills math histor
692,692,1064225835610226690,extra cranky baby could showing teething symptoms learn look find best teething remedi,cranky baby symptoms teething remedi
693,693,1063929487828688896,whether getting beginner phone elementary aged kid upgrading high tech phone,beginner phone kid tech phone
694,694,1063902934830845952,love list christmas books read special gifts holiday season co kjbreaoui,list christmas books gifts holiday season co kjbreaoui
695,695,1063880770790539269,ready baby eat trying conceive co mkm gel,baby eat co mkm gel
696,696,1063860361806401536,create ultimate gaming experience walmart deals tvs game consoles headsets,create gaming experience deals game consoles headsets
697,697,1063575359344513024,dress holiday table fun easy thanksgiving crafts kids,dress holiday fun crafts kids
698,698,1063550099299713024,baby cold outside got perfect indoor birthday party ideas kids co qjplg hng,baby birthday party ideas kids hng
699,699,1063518111444492289,real furreal pets toy every kid wants christmas co dxlvkllpa,pets kid co dxlvkllpa
700,700,1063465202572804096,looking laptop kids see top picks elementary school high school,kids picks school school
701,701,1063183633614299136,kids going mad grumblies holiday season see fuss buy,kids grumblies season see
702,702,1063141349464117249,three crowd step step guide getting toddler sleep bed,step step toddler sleep bed
703,703,1063113815167025152,character covered cute simple sophisticated kids love backpacks,character simple kids love backpacks
704,704,1062857904330563584,traveling holidays relax got ways keep kids entertained airplane,holidays ways kids airplane
705,705,1062776143546322944,pomsies toy every kid wants christmas plus buy co gbntnfck,pomsies kid co
706,706,1062748657655668738,fun educational toys great children special needs co yxfzi btdi,fun children needs yxfzi btdi
707,707,1062451749527666688,awesome toys boost baby brain development co shmsj lwsx,boost baby brain development co shmsj lwsx
708,708,1062421015551193088,difference humidifier vaporizer need baby dry skin congesti,difference vaporizer baby skin congesti
709,709,1062420050022461446,xbox one games kids earn cool points christmas co rnmdxj sc,xbox games points rnmdxj sc
710,710,1062385361115144194,bigger always better cheap stocking stuffers kids small treasures,stuffers kids treasures
711,711,1062057784689094656,mom dad deserve holiday gifts favorite ideas co akcnbromvz,mom dad deserve holiday gifts ideas akcnbromvz
712,712,1062049102270218242,implantation bleeding vs period spot early pregnancy symptom co rclmi sfs,implantation period pregnancy symptom co rclmi sfs
713,713,1062019713088270341,grumblies pomsies lego see top toys want walmart year co nuuqxno,grumblies pomsies toys year co nuuqxno
714,714,1061750074148032515,force little one holiday season awesome star wars gifts kids,force holiday season star wars kids
715,715,1061726566881869824,nerf nintendo hatchimals fingerlings see top toy picks amazon holiday season,hatchimals fingerlings toy picks holiday season
716,716,1061707613795217412,dress thanksgiving table fun easy decorations,dress fun decorations
717,717,1061695776370446337,think might pregnant early signs co dp dqfvv,think signs dp dqfvv
718,718,1061405944188452864,wait till black friday start holiday shopping grab amazing amazon deals,wait till start holiday shopping grab amazon deals
719,719,1061368523132489735,whether want top line console handheld video game fun simple throwback game system,line game fun throwback game system
720,720,1061327233091072002,inexpensive holiday presents kids boring check fun christmas gifts,holiday presents kids check fun christmas gifts
721,721,1061042622251368455,find fertile window based menstrual cycle ovulation day,fertile window cycle ovulation day
722,722,1061009940763033600,fingerlings hugs selling fast holiday season snag one kid,fingerlings hugs holiday season kid
723,723,1060956676852011008,best playstation games kids earn cool points,playstation games kids points
724,724,1060672569416781826,nerf fingerlings nintendo best kids christmas toys buying amazon,fingerlings kids christmas
725,725,1060614944641703938,got little gamer home best xbox one games score christmas,home xbox games christmas
726,726,1060599243197562880,figuring kid fever harmless serious tricky guide help,kid fever harmless guide help
727,727,1060324407720243200,get little one spirit holiday season must read christmas books kids,spirit holiday season christmas books kids
728,728,1060271277875884032,baby alive kumikreator crate creatures toys buying target christmas,baby kumikreator crate creatures target christmas
729,729,1060011179656052739,amazon slew black friday toy deals snag right buying,amazon deals buying
730,730,1059969407701659648,whether want hold indoor celebration weather unpredictable fun indoor birthday,hold celebration fun indoor birthday
731,731,1059895910174470146,ready set shop toys want walmart year,shop year
732,732,1059558777689702400,bundle joy squeal delight silly soft smart christmas gifts babies,joy delight christmas gifts babies
733,733,1059543774001594369,whether want top line console handheld video game fun simple throwback game system,line game fun throwback game system
734,734,1059225257272401920,listen mom dad tech gadgets game changers co wmgmmtrjz,mom dad gadgets game changers wmgmmtrjz
735,735,1059159582377996289,helicopters kites drones motorized paper planes kids flip awesome flying toys,helicopters drones paper planes kids toys
736,736,1058810998998659073,tired getting good night sleep step step guide getting toddler sleep ow,night step step toddler sleep ow
737,737,1058782288597655553,holidays stressful especially flying kids luckily found ways keep,holidays kids ways
738,738,1058701061182156800,awesome gifts grandparents guaranteed make favorite,gifts grandparents
739,739,1058548389376331777,get jump start holiday shopping amazon early black friday deals toys shop,start holiday shopping deals shop
740,740,1058525697537437697,fun bath toys kids really make splash co jw csd ea,fun bath kids splash co jw csd ea
741,741,1058488139382210560,eye rubbing smiling crying find baby signals mean respond,eye signals respond
742,742,1058423893189378052,teens tweens tricky shop love list gift ideas,teens shop list gift ideas
743,743,1058125347999367168,need paw patrol birthday party ideas yelp help read inspiration,need paw party ideas inspiration
744,744,1058115017168617472,amazon black friday deals already begun see toys grabbing gone,deals
745,745,1058062192786968587,amazon already kicked black friday toy deals start saving shop,amazon deals shop
746,746,1058052369387261956,adorable turkey crafts projects keep kids busy brighten thanksgiving decorations,turkey crafts projects kids decorations
747,747,1058022977449742336,psst target sneak peak amazing black friday deals shop today shop,psst target deals today shop
748,748,1058009586169454594,let holiday season begin start christmas prep early list best toddler toys gifts,holiday season christmas list toddler toys gifts
749,749,1057766065734852608,whether got baby toddler exactly pack diaper bag co hagmrmq,toddler bag co hagmrmq
750,750,1057736243671433218,wallet friendly baby shower gifts guaranteed please co pqooy,wallet baby gifts co pqooy
751,751,1057682454746664961,make halloween extra spooky scary fun halloween movies kids,spooky fun movies kids
752,752,1057371573697630209,prep toddler years unexpected essentials kids ages co bhtfzchahd,toddler years essentials kids ages bhtfzchahd
753,753,1057342325658189825,make halloween party howling success creepy fun treats,party success creepy fun treats
754,754,1057287580021071872,fun st birthday party ideas plus everything need invitations party supplies,fun st birthday party ideas everything invitations party supplies
755,755,1057010347222204418,still need last minute halloween costume little one try easy diy outfits,minute try outfits
756,756,1057010226363355137,make kid star show fun personalized books kids,kid star show fun books kids
757,757,1056953928150122497,hush little baby brahms lullaby lyrics popular songs babies,hush baby lyrics songs babies
758,758,1056637613044588544,throw kid howlin halloween birthday party hauntingly fun ideas,throw kid howlin birthday party ideas
759,759,1056229256295014402,little monsters love disgusting delicious halloween party treats,monsters party treats
760,760,1055920016581890050,woodland creatures apple harvests got fall baby shower ideas everyone love,woodland creatures apple harvests baby shower ideas everyone love
761,761,1055888469149564930,ready make baby food gadgets help co ys lp xdhm,baby food gadgets lp xdhm
762,762,1055800843591655425,still need halloween costume inspo little one try easy diy ideas,try diy ideas
763,763,1055584316670046208,brain boosting board games fun whole family co laflvnklkx,brain board games family co laflvnklkx
764,764,1055552529344409600,get spooky spirit fun halloween movies kids,spirit fun movies kids
765,765,1055521297877340160,sweet dreams pregnancy pillows designed cradle bump provide maximum relaxation,dreams pregnancy pillows bump relaxation
766,766,1055202087510962176,take bedtime whole new level dreamy toddler house beds,bedtime level toddler house beds
767,767,1055144661029961729,nerf blasters melissa amp doug dress sets little ones love picks best toys kids,blasters doug dress ones picks toys kids
768,768,1055107343321587713,everything need plan frightfully fun halloween birthday party,everything need plan birthday party
769,769,1054833612129009664,character covered cute simple sophisticated kids love backpacks,character simple kids love backpacks
770,770,1054780142806056960,disney halloween costumes kids cute right shop favorites,disney halloween costumes kids cute shop favorites
771,771,1054779848189767680,kid coolest playroom block fun functional pieces,kid playroom block fun pieces
772,772,1054463471906156545,potty training three days yes make happen,days
773,773,1054399524108713984,keep little ones safe baby gates every area house,ones baby gates area house
774,774,1053410176949198848,get spirit season list best halloween movies kids,spirit season list movies kids
775,775,1053375285649903616,pottery barn kids cute halloween costumes major sale right shop favorites,pottery barn kids costumes sale right shop favorites
776,776,1053358346726715393,fun educational toys great kids special needs,fun kids needs
777,777,1053304397504110593,best baby carriers wraps slings amp beyond,baby carriers slings
778,778,1053050025230692352,guide buying breast pump according pros,guide breast pump pros
779,779,1052980903629217792,throw kid howlin halloween birthday party hauntingly fun ideas,throw kid howlin birthday party ideas
780,780,1052744171629531136,wait holiday shopping save amazon fire tablet kids edition exclusiv,wait holiday shopping amazon fire tablet kids edition exclusiv
781,781,1052663311735709696,everything need know looking infant car seat convertible car seat booster seat,everything need car seat car seat booster seat
782,782,1052593572762013696,mickey mouse vampirina disney halloween costumes spook tacular sale right check,mickey mouse disney halloween costumes sale
783,783,1052583073748058112,anti aging products use expecting,products
784,784,1052300608319963136,make splash fun bath toys co jw csd ea,splash fun bath jw csd ea
785,785,1052254607160856576,appalling appetizers disgusting desserts need howling good halloween party,appetizers desserts halloween party
786,786,1052221355788300288,diy halloween costumes baby adorable easy pull together,diy costumes pull
787,787,1051930069898354688,fun personalized storybooks kids combine entertainment education,fun kids entertainment education
788,788,1051926803982544898,keep little one safe must home products,home products
789,789,1051639133062553601,get jump start holiday shopping exclusive discount amazon fire tablet kids edition,start holiday discount amazon fire tablet kids edition
790,790,1051574159283822594,character covered cute simple sophisticated backpacks kids stylish sturdy safe,character simple backpacks kids sturdy
791,791,1051498093680693253,pottery barn kids halloween costumes cute sale right check favorites,pottery barn kids costumes sale favorites
792,792,1050883403149664256,woodland animals apple harvests love fall baby shower theme ideas,woodland animals apple harvests fall baby theme ideas
793,793,1050810263551836160,helicopters drones kites see kids flying toys made must list,helicopters drones kites kids toys
794,794,1050765621598797824,everything need throw frightfully fun halloween birthday party,everything need birthday party
795,795,1050455391795077120,baby gifts guaranteed please,baby gifts please
796,796,1050404667602153473,save big amazon fire tablet kids edition exclusive discount offer,amazon fire tablet kids edition discount offer
797,797,1050402579124035584,stay comfy stylish leggings fleece lined faux leather,stay comfy leggings fleece leather
798,798,1050172829197619202,baby bottle right check top picks,baby bottle check top picks
799,799,1050133404321234960,little monsters love gross halloween recipes,monsters halloween recipes
800,800,1050079456658894849,need buy elaborate costume try fun diy halloween looks little pumpkin,need costume try fun diy pumpkin
801,801,1049765649420029952,awesome educational toys boost baby development,toys baby development
802,802,1049748744273633280,matter choose share surprise key gender reveal party supplies,matter choose share surprise key gender reveal party supplies
803,803,1049684260981002241,black panther vampirina conjured best disney halloween costumes kids year,panther vampirina disney halloween costumes kids year
804,804,1049396646499487745,practical precious baby shower gifts sure hit,baby gifts hit
805,805,1049343902787010561,kid coolest playroom block fun functional pieces,kid playroom block fun pieces
806,806,1049334087931125761,difference vaporizer humidifier best baby,difference vaporizer baby
807,807,1049094873029206016,need buy elaborate costume try fun diy halloween looks little pumpkin,need costume try fun diy pumpkin
808,808,1048337440170233856,combed best baby hair care tips infant hair products,baby hair care tips hair products
809,809,1048299469320740867,need help navigating sea new baby gadgets check top tech picks,need help baby gadgets tech picks
810,810,1048281906532536322,black panther vampirina conjured best disney halloween costumes kids year,panther vampirina disney halloween costumes kids year
811,811,1047983940789850112,whether got baby toddler exactly pack diaper bag,toddler bag
812,812,1047902915908833281,parent toddler going need essentials,parent toddler need essentials
813,813,1047894037825564672,save disney halloween costumes right favorites,disney halloween costumes favorites
814,814,1047632791561756672,kid love sleep one dreamy toddler house beds,kid dreamy toddler house beds
815,815,1047557762698436609,get kiddos halloween spirit fun spooky movies,kiddos spirit fun spooky movies
816,816,1047548547145633794,items help make breastfeeding little comfortable,items
817,817,1047219337868795904,need paw patrol birthday party ideas yelp help read inspiration,need paw party ideas inspiration
818,818,1047148971871952897,flying somewhere kids fall try activities keep entertained,kids try activities
819,819,1047148850081861633,easy sew diy halloween costumes genius,sew diy costumes
820,820,1046860735274528769,fun educational toys great children special needs,fun children needs
821,821,1046788735159947264,everything need plan frightfully fun halloween birthday party,everything need plan birthday party
822,822,1046507112355041280,woodland creatures apple harvests love fall baby shower themes,woodland creatures apple harvests fall baby themes
823,823,1045754543122927616,disney halloween costume sale ones shopping,disney halloween sale ones
824,824,1045743931097567232,design tactics help stop territorial disputes shared bedrooms,design tactics disputes bedrooms
825,825,1045690228042805248,check money saving tips head grocery store weekend,money tips grocery store weekend
826,826,1045438451041140738,planning disney vacation stock essentials go,disney vacation stock essentials
827,827,1045382870527864833,want make sure high chairs registry,make chairs registry
828,828,1045341280824414208,pottery barn kids halloween costumes cute sale,pottery barn kids costumes sale
829,829,1045054061807116291,potty training easier methods,methods
830,830,1045038033232449536,adorable easy diy halloween costumes,diy halloween costumes
831,831,1044993972089901057,everything kiddo needs coolest playroom block,everything kiddo playroom block
832,832,1044969275642052609,upgrade insta game never miss moment cameras,insta game moment cameras
833,833,1044686454729965575,habits want child develop become teen,habits child become teen
834,834,1044633121029836810,bedding sets make teen girl bedroom,sets girl bedroom
835,835,1044328241937502208,super quick ab workouts perfect mom go,super quick ab workouts mom
836,836,1044273660033466370,basics boring stock boy wardrobe essentials great wardrobe want,basics stock boy wardrobe essentials wardrobe
837,837,1044266437731397632,save disney halloween costumes right ones buying,disney halloween costumes ones
838,838,1043286605291835392,oh baby got adorable diy halloween costume ideas little pumpkin,baby diy ideas
839,839,1043273436976570368,car seat shopping,car seat shopping
840,840,1043157495630450688,ultimate guide baby shower,guide baby shower
841,841,1042938646633107456,want add pediatrician approved picks baby registry,add picks registry
842,842,1042908252751704064,beauty brands perfect teen girl building make collection,beauty brands girl collection
843,843,1042834412327657473,swaddling baby try alternatives,baby try alternatives
844,844,1042563689415671809,disney cutest halloween costumes kids favorites,disney cutest halloween costumes kids favorites
845,845,1042553991928983552,leggings working stay comfy stylish finds fleece lined faux leather,leggings stay finds leather
846,846,1042513240352272385,wetting bed problem house try suggestions accident free night,bed problem house try suggestions night
847,847,1042460546195501058,baby proof entire home ultimate guide,baby proof home ultimate guide
848,848,1042142661367525376,everything need get mealtime minimal mess,everything mess
849,849,1042072207663538177,grocery list need feed family week,grocery list family week
850,850,1041755062622711811,looking cool diy sew costume ideas see favorite looks using everyday wear,diy sew costume ideas looks wear
851,851,1041741550382993408,nursing bras actually cute sign us,nursing bras
852,852,1041669163859816448,dads take note books read enjoy kids,dads note books enjoy kids
853,853,1040731997289758720,wait new year manage family finances,wait year manage family finances
854,854,1040658856739840001,technology picks feel good giving child matter age,technology picks matter age
855,855,1040360049464492032,glass baby bottles must registry,glass baby bottles
856,856,1040327857845809152,last chance disney halloween costume sale ends tonight buying,chance disney halloween sale ends
857,857,1040253987646332928,panic free guide pregnancy diet,guide pregnancy diet
858,858,1040016834748182530,baby shower games oh fun best free,baby games fun
859,859,1039899848546439168,manage mess playroom storage solutions,manage mess playroom storage solutions
860,860,1039617031589580801,baby products regret splurging,baby products
861,861,1039560490001854464,car seats clothes toys amazon september baby sale includes parenting essentials eve,car seats september baby sale essentials
862,862,1039531318269411328,never want leave bed get one pregnancy pillows,pregnancy pillows
863,863,1039228179960004609,disney halloween costume sale scary good deals shop favorite picks,disney halloween sale deals picks
864,864,1039211997672419328,maternity jumpsuits take babymoon baby shower,maternity jumpsuits babymoon baby shower
865,865,1039137599540088832,make caring toddler simpler parenting hacks,toddler simpler parenting hacks
866,866,1038891611005112320,nordstrom summer sale ends today shop favorite clothing picks little boys,summer sale ends today clothing picks boys
867,867,1038852524097323009,got little one way catch zzzs right dreamy pregnancy pillows,way catch zzzs dreamy pregnancy pillows
868,868,1038479982576721920,nordstrom summer sale perfect excuse fill little girl closet fall staples stock,summer sale perfect excuse girl fall staples stock
869,869,1038193768476946437,whether toddlers tweens bound discipline issue two top co,toddlers tweens issue co
870,870,1038158009317433344,plan best birthday party class paw patrol theme guide,plan party class paw patrol theme guide
871,871,1038077574331752449,believe adorable baby boys clothes found nordstrom summer sale check favorites,baby boys clothes summer sale check favorites
872,872,1037853750579347458,find expect baby due date calculator,baby date calculator
873,873,1037812601911160834,best dressed bump around stylish maternity looks nordstrom summer sale,bump maternity summer sale
874,874,1037760797005541377,find best picks fall shoes babies kids,picks fall shoes babies kids
875,875,1037440394244579328,nordstrom summer sale sweetest baby girls clothes check favorites,summer sale sweetest baby girls clothes favorites
876,876,1037412581915484161,creative way announced pregnancy,way pregnancy
877,877,1037358232187092994,gain peace mind bring baby home top picks safety technology,gain peace mind bring baby home top picks safety technology
878,878,1037077644175654914,disney huge sale halloween costumes favorites,disney sale halloween favorites
879,879,1037056504820641792,score major deals baby gear right nordstrom summer sale,score deals right summer sale
880,880,1036996674038706177,catch extra zzz guide best sleep pregnant,catch zzz guide sleep pregnant
881,881,1036700505098145793,trendy maternity clothes flatter body,maternity clothes body
882,882,1036664171256061953,whether traveling labor day planning ahead thanksgiving need know trave,labor day need know
883,883,1036636448416522242,child birthday cake stand rest class one unique cakes,child birthday class unique cakes
884,884,1035632307154116608,best ways lose extra baby weight,ways baby
885,885,1035578778582433792,make space perfect homework help picks houzz,space perfect homework help picks
886,886,1035288561006903296,clothes girl actually want wear season,clothes season
887,887,1034831159866392581,everything need cutest coziest nursery babe,everything babe
888,888,1034607605031862273,plan best family road trip ever tips,plan family road trip tips
889,889,1034542774144708608,find perfect baby gate every space home,baby gate space home
890,890,1030161225555103745,find us target weekend picking last minute items school supply list,weekend items school supply list
891,891,1028019195508924417,cutest new styles back school pediped footwear,styles school
892,892,1027933385950412801,hilarious truths school different parent,school parent
893,893,1027341115740090374,school uniform staples earn plus style,school staples style
894,894,1027288094901334017,save money back school shopping tips,money school shopping tips
895,895,1026542570120171520,learn make transition toddler bed little easier read,learn transition toddler read
896,896,1026489690654945281,ease children back school tips,ease children school tips
897,897,1026194725890609152,get baby gear need price miss nordstrom anniversary sale ends today,baby price miss sale ends today
898,898,1025864937594408960,bump style maternity finds nordstrom anniversary sale better hurry deals,bump style maternity sale hurry deals
899,899,1025472486538981376,check tips trouble getting little one sleep soundly,tips trouble sleep
900,900,1025396256590516226,boys back school rounded best picks nordstrom anniversary sale send,boys school picks sale send
901,901,1025183522712109056,lego lover sequined diva lunch box suit every child unique personality,lego lover lunch box suit child personality
902,902,1025146233730543616,found best girls back school clothes nordstrom anniversary sale take stress,girls school clothes sale stress
903,903,1024030217478856704,stage summer break,stage summer break
904,904,1021856084422807552,shop baby gear needs discount nordstrom anniversary sale,shop baby discount nordstrom sale
905,905,1021462051607236609,bump style fab maternity finds nordstrom anniversary sale,bump style maternity sale
906,906,1020750604522741760,get girl outfitted less favorite back school picks nordstrom anniversary sale,school picks sale
907,907,1020405008926375937,shop coolest back school clothes boys nordstrom anniversary sale,shop school clothes sale
908,908,1020030328415637504,nordstrom anniversary sale officially starts tomorrow card members early access sho,sale tomorrow card members access sho
909,909,1019406560005709824,shop back school needs prime day deals hurry sales end tonight,shop school needs day deals sales end tonight
910,910,1019388217878089731,true,
911,911,1019362111141629963,members family took news really hard pregnancy reveal go,members family news pregnancy reveal
