,Unnamed: 0,id,cleaned_word_list,cleaned_word_list_nouns
225,225,1146467060849020928,robeez huge sale,robeez sale
226,226,1146106976318971909,break mores fourth july weekend,break mores july weekend
227,227,1144671942957510657,got anniversary coming,
228,228,1144284681971601408,live facebook amp,facebook amp
229,229,1143984966281379853,bring sand kiddos summer,bring sand kiddos summer
230,230,1143630256554807296,moms want try toxin free cruelty free vegan nail polish,moms try toxin cruelty vegan polish
231,231,1141773925204025345,check round best strollers every family,check round strollers family
232,232,1141423141132079105,check adorable toy story moccassins sold,check story moccassins
233,233,1141094424761524226,get much needed rest awesome products sleep deprived parens,rest awesome products parens
234,234,1140690848042143744,new dad andy cohen shared must haves new dads got list,dad andy cohen dads list
235,235,1139238019876212736,check awesome last minute father day gifts still time buy something dad,check minute day gifts time something dad
236,236,1138844846955933697,rounded best anti aging products break bank,anti products bank
237,237,1138556202969894917,goal girl celebrate usa women soccer team big win rounded best soccer gear girls,goal girl celebrate women team win soccer girls
238,238,1138180890406850561,rounded cutest daddy looks ahead father day,day
239,239,1137001488184696832,check awesome gifts accessories celebration,gifts accessories celebration
240,240,1136664007585226762,rounded best swim diapers little one make one fun summer,swim diapers fun summer
241,241,1136008271742025728,mattresses babies toddlers help little one get rest need,mattresses toddlers get rest need
242,242,1134888919886159873,national pineapple day celebrate rounded cutest toys gifts everyone family,pineapple day gifts everyone family
243,243,1134558826361950208,eva amurri martino recently launched line mommy outfits,eva amurri martino line mommy outfits
244,244,1134176953462874114,shoes pregnant women comfy stylish,shoes women
245,245,1133806048819712001,moms love amazing spa treatments home,moms spa treatments home
246,246,1133764777820479488,pacifiers picks best,pacifiers picks
247,247,1131603125289324544,rounded best books kid summer reading list,books summer reading list
248,248,1130557764554637313,find shopping list exclusive interview,list interview
249,249,1129433791666241539,stock kitchen essentials secure meal person need walmart fight hunger campaign,stock kitchen essentials person hunger campaign
250,250,1129061680149872640,tents sleeping bags everything got everything need family next camping,tents bags everything everything family camping
251,251,1128710422226452480,mila emma stauffer done check newest collection sells,mila emma check collection
252,252,1128343274312351745,check exclusive interview real housewives potomac star monique samuels,interview housewives star monique samuels
253,253,1127959298519240709,pottery barn kids launched toy story line want,pottery barn kids story line
254,254,1126902004368986114,grocery purchases help walmart fight hunger campaign secure billion meals need,grocery purchases hunger campaign secure meals
255,255,1126268775597248512,want get meghan maternity style rounded best looks celebrate archie arrival,get maternity style looks arrival
256,256,1126163465423421440,mother day days away still time grab last minute gift picks,day days time grab minute gift picks
257,257,1125801440163901440,detective pikachu hits theaters may rounded best toys gifts celebrate movie,pikachu theaters gifts movie
258,258,1125433644577906688,royal baby let look back duchess meghan best maternity fashion moments,royal baby duchess meghan maternity fashion moments
259,259,1124349347511115783,gear next adventure great hiking boots kids,adventure boots kids
260,260,1124021684158251009,freshen routine spring multi purpose beauty products,spring multi beauty products
261,261,1123646826568089600,best leggings postpartum months need lot support,leggings months lot support
262,262,1123620707353747458,macy major sale maternity kids clothes want,macy sale maternity kids clothes
263,263,1123305553609003008,check list diaper bag must haves thankful,check list bag
264,264,1123262317817470980,going want everything arielle noa charnas new collection children nordstrom,everything arielle collection children
265,265,1122899435112022021,crewcuts available amazon rounded favorite picks,crewcuts amazon picks
266,266,1121930423997743104,actress shares must summer picks kids,shares summer picks kids
267,267,1121484844918345731,support growing bump maternity belts belly bands,support maternity belts bands
268,268,1121453532748623874,mom blogger influencer shares must haves twins good,mom blogger shares twins
269,269,1121094031965028352,toddlers love awesome water tables parents love keep busy hours,toddlers water tables parents hours
270,270,1120780515978752000,spring time allergies met match amazing humidifiers kids,spring time allergies match humidifiers kids
271,271,1120721783697571842,parents kids love new sensory friendly furniture collection,parents kids furniture collection
272,272,1120358668468400129,happy earth day celebrate making home eco friendly awesome products,earth day products
273,273,1118915978568642560,actress threw daughter kenzie tea party birthday fit royalty shared party plan,actress kenzie tea party birthday royalty party plan
274,274,1118593285126328320,keep kids safe healthy great products kids allergies,kids products kids allergies
275,275,1118564323465543681,get glowing skin inside wellness supplements,wellness supplements
276,276,1118286835371913216,still time grab one adorable personalized easter baskets,time easter baskets
277,277,1118228681741217792,eco friendly products baby also super friendly planet score,products baby planet score
278,278,1118177632854642688,check exclusive interview actress,interview actress
279,279,1117832675837075458,mom fashion influencer wrote fab new book,mom fashion influencer book
280,280,1117173905041633280,shop trendiest sneakers season whole family,shop sneakers season family
281,281,1117173353071009792,got trendiest spring sneakers whole family course amazing prices,spring sneakers family course prices
282,282,1116743999296102404,check latest spring fashion trends moms,check spring fashion trends moms
283,283,1116427908447461377,first time moms love sweet mother day gifts,time moms day gifts
284,284,1116018704259715085,make diaper duty little easier simple stylish diaper pails,diaper duty diaper pails
285,285,1115740815261863936,major sale toys happening right one day hurry,sale toys day hurry
286,286,1115691335862898689,honor rounded magical unicorn gifts kids,honor gifts kids
287,287,1115607299433824256,new lego sets boys girls perfect tiny brick builder life,sets girls brick builder life
288,288,1115285976593698816,tips mom influencer mindy mcknight aka keep kids safe online,tips mindy mcknight aka kids online
289,289,1114176754187370496,teethers help baby teething discomfort plus super cute taco teethers yes plea,teethers cute taco teethers plea
290,290,1113975105510625281,best soothers sound machines little one,soothers machines
291,291,1113520328737792001,scientist gives us inspo need help kids next science fair project chec,scientist science fair project chec
292,292,1113080965503574016,miss atlantis paradise island summer savings event week book dream vacation,miss atlantis paradise island summer savings event week book dream vacation
293,293,1112751060182056960,celebrate april fool day joke books kids,celebrate day books kids
294,294,1111662923896811521,take trip memory lane awesome retro toys,trip memory lane retro toys
295,295,1111284074671456256,check amazing ways store breastmilk,check ways breastmilk
296,296,1110896093334851584,forget elf shelf peep perch perfect easter gift kids,easter gift kids
297,297,1110617387173318658,guys collabed line kids shoes get sell,guys line kids shoes
298,298,1110617108323450883,collabed line kids shoes get sell,line kids shoes
299,299,1110518183084077056,going want grab adorable baby moccasins,grab baby moccasins
300,300,1108766266523860992,pacifiers picks best,pacifiers picks
301,301,1108464865398702080,favorite flying elephant hits theaters days march get ready highly antici,hits theaters days
302,302,1108428615195201538,personalized easter baskets make lasting memories years come,baskets memories years
303,303,1108368677047599104,ways keep kid entertained plane make next vacation go much smoother,ways kid plane vacation
304,304,1108066660664201217,check picks best training bras teens tweens,check picks bras teens tweens
305,305,1108015595574960128,mattresses babies toddlers help little one get rest need,mattresses toddlers get rest need
306,306,1107784681385267200,bunnies birdies spring cakes perfect way celebrate season,bunnies birdies cakes way celebrate season
307,307,1107723393816776706,sex ed books great way teach kid birds bees,sex ed books way kid birds bees
308,308,1107680909430571008,moms love amazing spa treatments home,moms spa treatments home
309,309,1106946741440602113,rounded favorite seuss themed clothing toys little ones love books stories,seuss ones books stories
310,310,1106563959220510720,keep little one looking sharp hot spring fashion trend kids,spring fashion trend kids
311,311,1106344878588522497,going want grab adorable baby moccasins,grab baby moccasins
312,312,1105923206563725318,little princess look adorable gorgeous flower girl dresses,look girl dresses
313,313,1105540807971483653,get ready spring nature inspired crafts kids,spring nature crafts kids
314,314,1105180964978855936,fingerlings released four new narwhal editions cute buy,fingerlings editions
315,315,1104816084316762118,everything tired moms need survive daylight savings,everything moms daylight savings
316,316,1104440866389852160,girl celebrate limited edition barbie clothes accessories girls,girl celebrate edition barbie clothes accessories girls
317,317,1104129094516727809,get kids ready spring break comfortable travel clothes,kids spring break travel clothes
318,318,1103753808910475264,get jump easter rush great gifts toddlers,jump easter rush gifts toddlers
319,319,1103349658464727040,march music schools month celebrate great musical toys kids aggravate,march music schools month toys kids
320,320,1103009115738120193,easy green adorable st patrick day outfits baby,st day baby
321,321,1102656856856690693,wait till see inside meghan markle baby shower gift bags,wait till markle baby gift bags
322,322,1101881179341500416,celebrate birthday one amazing gifts kids,celebrate birthday amazing gifts kids
323,323,1101581110620966913,jason biggs thinks meghan markle needs magical baby gift,jason biggs markle baby gift
324,324,1101542577164242944,captain marvel hits theaters exactly one week empower little superhero great gifts girls,captain marvel theaters week empower gifts girls
325,325,1101268800681492480,everything inside meghan markle awesome baby shower gift bags buy,everything baby gift bags
326,326,1101211611828768770,everything need throw best baby shark birthday party ever,everything need baby shark birthday party
327,327,1100814162261876737,get kid moving awesome running shoes,kid running shoes
328,328,1100446601024294914,put ipad away grab one fun challenging brain teaser toys kids,put fun brain teaser kids
329,329,1100162892555534336,mila emma stauffer target line selling like crazy snapping,mila emma target line crazy snapping
330,330,1100063975272824832,yes amp launched eco friendly baby line going wa,yes baby line wa
331,331,1099671380163993600,shook mila emma line dropped selling fast,shook mila line
332,332,1099044978788089858,oh baby nordstrom epic winter sale includes major steals maternity swimsuits see styles scoring,baby epic winter sale steals maternity swimsuits styles
333,333,1099032288254480384,go stylishly hands free great teething necklaces baby mom love,hands necklaces
334,334,1098642189423394817,excited new movie scoop one gifts instead waiti,movie scoop gifts
335,335,1098277074366877698,ready try great organizational products kids rooms kiss clutter goodbye,products kids rooms clutter goodbye
336,336,1097875461105991680,february celebrate one amazing electric toothbrush,celebrate amazing toothbrush
337,337,1097580130954870784,mr potato head spirograph love retro toys kid,mr potato head spirograph love retro kid
338,338,1096626011272286208,baby gear buying sale amazon right,baby sale amazon right
339,339,1096465694047326209,matter sport kid got covered awesome sports team gear,matter sport sports team gear
340,340,1096245052278558726,exciting news train dragon fans,news train dragon fans
341,341,1096135241234870272,plans valentine day got covered great day ideas whole family,plans day day ideas family
342,342,1095366310572318720,got budding techie hand encourage skills great stem toys,hand encourage stem toys
343,343,1095024753025404938,kick cold weather blues curb awesome activities kids co ensje,kick blues activities kids ensje
344,344,1093980850520276995,olaf would proud fabulous birthday party ideas,olaf birthday party ideas
345,345,1093909669364580352,everything awesome celebrate release fun lego sets,everything celebrate release fun lego sets
346,346,1093700686137753601,many stem toys fun also inspire creativity home school,stem toys fun creativity home school
347,347,1093691204875808769,smile best toothbrushes babies toddlers,smile toothbrushes toddlers
348,348,1093667722536382464,fun games cupid inspired cookie decorating love valentine day activities families,fun games cookie valentine day activities families
349,349,1093319193548767233,choose best shoes baby plus favorite picks,choose shoes picks
350,350,1093269689780850688,found everything need throw ultimate elmo themed birthday party,everything need elmo party
351,351,1093208545414266880,thinking getting kid phone best options every age,kid phone options age
352,352,1092976047098945536,whether pregnant post baby found perfect subscription boxes make life little sweeter,post baby subscription boxes life sweeter
353,353,1092917706653921281,celebrate year pig adorable pig themed gifts babies toddlers,year pig pig babies toddlers
354,354,1092858184216260610,classic denim cuddly bunny ears love stylish sweet spring jackets toddlers,denim ears spring jackets toddlers
355,355,1092795875523526657,new parents appreciate sweet soothing gifts,parents soothing gifts
356,356,1092592619916529664,see luggage buying pottery barn kids epic sale,see luggage pottery barn kids sale
357,357,1092542833200906240,make someone day sweet valentine day crafts little love,someone day day love
358,358,1092474528654086144,fun sleds saucers tubes toboggans great gliding season,fun saucers tubes toboggans gliding season
359,359,1092266941715308545,everything need put together perfect baby nursery,everything need baby nursery
360,360,1092238627294318592,sexy comfy lingerie pieces perfect valentine day every day,comfy lingerie pieces day day
361,361,1092143189459431424,turned experts help choose right breast pump breastfeeding needs,experts breast pump breastfeeding needs
362,362,1092127083948584961,get board awesome train sets kids,board train sets kids
363,363,1091843421743050757,keep baby cozy sweet crib bedding,baby crib bedding
364,364,1091799231797645317,tiny toes look trendy adorable baby moccasins,toes baby moccasins
365,365,1091723843629182976,ready cut cord cable best streaming services families,cut cord cable streaming services families
366,366,1091553713297256450,fun personalized storybooks make budding bookworm hero story,fun storybooks bookworm hero story
367,367,1091496821065687042,duchess sussex queen maternity looks steal cozy winter style,duchess sussex maternity winter style
368,368,1091404043866566656,little love look extra sweet valentine day outfits,look day outfits
369,369,1091181871650783232,bump pregnancy style chic practical maternity clothes popular retailers,pregnancy style maternity clothes retailers
370,370,1091179839434960896,sweet stuffed animals educational toys check roundup best gift ideas year olds,stuffed animals toys roundup gift ideas year olds
371,371,1091068194926874624,treat little sweetheart adorable valentine day gifts,treat sweetheart day gifts
372,372,1090986272997429248,planning warm weather escape make splash one maternity swimsuits,warm weather escape splash maternity swimsuits
373,373,1090793748806729735,products hand make sure baby stays safe,products hand baby
374,374,1090759863003680768,stem toys fun inspire creativity teach necessary skills,stem fun inspire creativity skills
375,375,1090744957609095168,fun baby st birthday party ideas,fun baby party ideas
376,376,1090684049394462721,surprise superfan life love awesome gifts,surprise superfan life gifts
377,377,1090452550153879552,baby food mills steaming systems best reviewed versatile baby food makers th,baby food mills systems baby food makers
378,378,1090432940809613313,toys fun educational improve developmental skills,toys developmental skills
379,379,1090353730468433920,use valentine day crafts decorate home pass along family friends brighten,day crafts home pass family friends
380,380,1090329597491724288,barbie turning celebrate icon birthday fun dolls play sets,barbie icon birthday fun dolls sets
381,381,1090073160538566656,show parent pride adorable baby outfits,show parent pride baby outfits
382,382,1090052195456860160,montessori toys guaranteed imaginations running wild without bells whistles electr,montessori toys imaginations bells whistles
383,383,1089944965214552065,indoor outdoor activities keep kids busy prevent boredom throughout winter months,outdoor activities kids prevent boredom months
384,384,1089683755667783682,take bedtime whole new level dreamy toddler house beds,bedtime level toddler house beds
385,385,1089657685132406784,know little one turning love adorable gifts,gifts
386,386,1089636038274961410,fun educational toys help boost baby development,fun toys help baby development
387,387,1089606381798412289,baby cold outside bundle bump stylish maternity jackets,baby bump maternity jackets
388,388,1089356773503447046,pregnancy come lot aches pains belly bands maternity belts help,pregnancy lot aches maternity belts
389,389,1089274202849509376,boys girls ages love new lego sets,boys girls ages lego sets
390,390,1089254683909201920,planning nursery lot work came checklist must essentials,nursery lot work
391,391,1089232570208915458,gifts perfect new parents co lt bov,gifts parents bov
392,392,1088916260413415424,protect baby teeth soothe sore gums build healthy habits one colorful toothbrushes babies,protect baby sore gums habits colorful toothbrushes babies
393,393,1088881275430191106,say cheese found cool cameras great budding photographers ages,cheese cameras photographers ages
394,394,1088862068936269825,fabulously fun indoor birthday party ideas put smile faces rain shine,birthday party ideas rain shine
395,395,1088838967921905664,gorgeous pieces maternity lingerie perfect valentine day day,pieces maternity day day
396,396,1088581367900880896,guests love baby shower favors,guests baby shower favors
397,397,1088507188644114433,rounded valentine day gifts little sweethearts ages,valentine day sweethearts ages
398,398,1088480590586920960,thee high tech fitness trackers help keep healthy throughout pregnancy beyond,tech fitness trackers pregnancy
399,399,1088189723624071176,spread love valentine day sweet homemade crafts,spread day crafts
400,400,1088162047945261056,looking sharp check favorite ice skates kids toddlers teens,check ice skates kids toddlers teens
401,401,1088136848520577024,baby needs new pair shoes check guide choosing best footwear early walkers,baby pair shoes walkers
402,402,1088107003451457537,sweet dreams found cutest coziest crib bedding sets baby nursery,dreams coziest crib sets
403,403,1087864111315238912,little one coughing congested best humidifiers baby according experts,coughing humidifiers experts
404,404,1087819331482865664,cold bundle bump cozy maternity coats,bundle bump cozy maternity coats
405,405,1087787731734933505,budding biologists astronomers archeologists zoologists love science toys,biologists astronomers archeologists zoologists science toys
406,406,1087748712816873473,awesome readers guaranteed turn kids ages bookworms,readers kids ages bookworms
407,407,1087484637029515264,sleek simple diaper pails make diaper duty little bit easier,simple diaper pails duty bit
408,408,1087454773534699525,rounded favorite gifts toddlers little ones love,gifts toddlers ones
409,409,1087430850592104448,planning warm weather getaway make splash one stylish maternity swimsuits,weather splash maternity swimsuits
410,410,1087410624257236992,board games fun also boost brain power,board games brain power
411,411,1087137108739928064,give shrink small enough fit one little luxury dollhouses girls boys,shrink luxury dollhouses girls boys
412,412,1087106826527825925,try snow day activities beat winter boredom,day activities winter boredom
413,413,1087081834234691587,soothe baby skin dermatologist approved lotions,soothe baby dermatologist lotions
414,414,1087053713003462656,looking cut cord cable best streaming services families kids,cut cord cable streaming services families kids
415,415,1086833528770347018,rugged affordable laptops expensive personal computers best laptops kids,laptops computers laptops kids
416,416,1086805800574697472,cool clothes prepared meals check favorite subscription boxes moms,clothes meals subscription boxes moms
417,417,1086771032894115840,cute valentine day outfits babies,valentine day babies
418,418,1086712142546591745,try favorite indoor outdoor activities family fun snowy day,outdoor activities family fun snowy day
419,419,1086400891509460992,sleek maternity one pieces trendy tankinis gorgeous bikinis guaranteed looking like one,maternity tankinis bikinis
420,420,1086333545604247552,rounded coolest science fair experiments try home including color changing milk,science fair experiments home color milk
421,421,1086306012116803584,fun sentimental valentine day gifts perfect little sweetheart,fun day gifts sweetheart
422,422,1086049543454642181,turn playtime fun teaching moment classic colorful montessori toys toddlers,turn playtime fun moment montessori toddlers
423,423,1086020115617984512,cheap baby shower favors lame treat guests one amazing party favor options,baby shower favors treat guests party favor options
424,424,1085987010106531840,moms deserve feel sexy gorgeous pieces maternity lingerie trick,moms pieces maternity trick
425,425,1085698120342753282,show parent pride funny punny perfectly stylish baby outfits,show parent pride punny baby outfits
426,426,1085622563798175745,pregnancy come lot aches pains belly bands maternity belts help found,pregnancy lot aches maternity belts
427,427,1085597265564262405,meghan markle wore amp maternity dress get look,meghan markle maternity dress look
428,428,1085312337266049025,choosing rug baby nursery tricky found cute safe cozy,rug baby nursery tricky cozy
429,429,1085283487953891332,humidifier help ease misery wintertime coughs congestion favorites,help misery congestion favorites
430,430,1085244824331186176,treat little sweetheart one valentinte day gifts,treat valentinte day gifts
431,431,1085220006135255041,sweet picture books perfect grandparents read grandchildren,picture books grandparents grandchildren
432,432,1084975163559546882,formfitting black hatch dress purple aritzia number love meghan markle maternity style,hatch dress number meghan maternity style
433,433,1084932966021775360,wondering kate middleton got maternity dresses list best places buy maternity clot,middleton maternity dresses places maternity clot
434,434,1084903738660274177,twinkle twinkle little star wonder words relax lyrics favorite lu,twinkle twinkle star wonder words lyrics lu
435,435,1084874294956572678,better safe sorry must products protect baby keep healthy,sorry products baby
436,436,1084847627018092544,fitbit bellabeat fitness trackers help monitor safe prenatal exercises heart rates sleep pa,fitbit bellabeat fitness trackers prenatal heart rates pa
437,437,1084600467978625025,toys great kids special needs,kids needs
438,438,1084569854970081281,know little one obsessed surprise love gifts,surprise love gifts
439,439,1084547558150717440,try fun indoor outdoor activities beat cold weather boredom,fun activities weather boredom
440,440,1084516262129090568,baby cold outside stylish maternity coats keep warm weather,baby maternity coats warm weather
441,441,1084234348562403329,finding best stem tech toys hard rounded amazon favorites,stem amazon favorites
442,442,1084215588984111104,gotta catch em top pok games kids,gotta catch em pok games kids
443,443,1084196471728230406,looking sharp found awesome ice skates kids toddlers teens,ice skates kids toddlers teens
444,444,1084159985284722691,comfy sneakers nursing sports bra exercise essentials healthy pregnancy according,comfy sneakers sports bra exercise essentials pregnancy
445,445,1083869576226590721,best soothing baby lotions according dermatologists,baby lotions dermatologists
446,446,1083838958080020481,snow way got fun activities perfect snowy day,way activities day
447,447,1083805059140464641,listen best reviewed gaming headsets co mnwhcrt gc,headsets mnwhcrt gc
448,448,1083760537962496001,sweet stuffed animals educational toys check roundup best gift ideas year olds,stuffed animals toys roundup gift ideas year olds
449,449,1083511358203801603,say cheese favorite cameras kids toddlers teens,cameras kids toddlers teens
450,450,1083471906752421889,style little sweetheart something fun festive adorable valentine day outfits,style something fun valentine day outfits
451,451,1083445355893702657,earn major cool points kids get awesome playstation games,earn cool points kids playstation games
