,Unnamed: 0,id,cleaned_word_list,cleaned_word_list_nouns
452,452,1083404361718484993,planning nursery lot work came checklist essential items,nursery lot work items
453,453,1083152448125132800,awesome snow sleds kids make spirits soar,sleds kids spirits
454,454,1083101791947051008,sweet dreams cute cozy crib bedding sets perfect baby nursery,dreams crib sets baby nursery
455,455,1083073134180384768,flying somewhere family school vacation got ways entertain kid airplane,family school vacation ways kid airplane
456,456,1083030967055540224,pregnant puts lot strain body pregnancy pillows help best sleep,lot strain body pregnancy help sleep
457,457,1082823803623874562,whether looking baby bottles help prevent colic sturdy glass baby bottles soft silicone bottles,baby bottles glass baby bottles silicone bottles
458,458,1082754545762164738,let talk sex favorite gender reveal party ideas decorations,sex gender reveal party ideas decorations
459,459,1082713133406474240,diaper bag essentials parents leave home without,diaper bag essentials parents home
460,460,1082668856634675200,baby gifts less,baby gifts
461,461,1082393579056697344,fun family winter activities beat cold weather boredom,fun family winter activities weather boredom
462,462,1082338867318063109,stylish safe baby nursery rugs little one love,baby nursery love
463,463,1082309658688274438,looking paw patrol birthday party ideas need yelp help got,paw patrol birthday party ideas help
464,464,1082063401734602752,take bedtime whole new level dreamy toddler house beds co wuzsbtvby,bedtime level toddler house beds wuzsbtvby
465,465,1082040285474025472,baby shower party favors guests love,baby party favors guests
466,466,1082022625826750465,best personalized books kids,books kids
467,467,1082004734087712769,little one turning toddler need must products,toddler need products
468,468,1081688264560594952,best breast pump models every type need according experts,breast pump models type need experts
469,469,1081661668126609408,gotta catch em top pok games kids co eu eee,gotta catch em pok games kids eee
470,470,1081635176625684481,subscription boxes moms love,subscription boxes moms
471,471,1081611422382067713,kid ready phone top picks elementary age high schoolers,phone top picks age schoolers
472,472,1081333756873621504,fitness trackers help keep healthy throughout pregnancy beyond,fitness trackers pregnancy
473,473,1081302448629837826,practical precious baby shower gifts sure hit,baby gifts hit
474,474,1081275797820919814,fun st birthday party ideas baby co jlnseuoqul,fun st birthday party ideas co jlnseuoqul
475,475,1081254931389181953,bump pregnancy style buy maternity clothes actually want wear,pregnancy style maternity clothes
476,476,1080968703594897410,best educational board games kids families,board games kids families
477,477,1080944843453620224,best maternity workout clothes exercise gear healthy pregnancy according fitness experts,maternity workout clothes pregnancy fitness experts
478,478,1080916337675841537,implantation bleeding vs period spot early pregnancy symptom,implantation period pregnancy symptom
479,479,1080889211207798784,awesome snow sleds tubes toboggans kids make spirits soar,sleds tubes toboggans kids spirits
480,480,1080635542923026432,stress holidays finally one deserves treat mom see favorite little luxur,stress holidays treat mom luxur
481,481,1080621378213171200,lively indoor birthday party ideas kids,birthday party ideas kids
482,482,1080589643752620032,nordstrom half yearly sale ends tonight baby gear snapping asap,sale ends baby asap
483,483,1080549972976771072,stylish maternity coats keep baby warm weather,maternity coats baby warm weather
484,484,1080496307129778176,best humidifiers baby according experts reviews,humidifiers experts reviews
485,485,1080218592094928896,think might expecting early signs pregnancy,think signs pregnancy
486,486,1080200848582590464,best maternity leggings every stage pregnancy,maternity leggings stage pregnancy
487,487,1080176315297341447,listen best reviewed headsets,headsets
488,488,1080146619318841344,great gift ideas kids obsessed surprise,gift ideas kids surprise
489,489,1079848687818420224,jeans dresses bras see favorite fashionable maternity finds nordstrom half yearly sale,jeans bras maternity half sale
490,490,1079764887730077698,keep family healthy winter save regular priced fsa items code fsa,family winter fsa items fsa
491,491,1079757500977737729,say cheese coolest cameras kids toddlers teens,cameras kids toddlers teens
492,492,1079527285907226625,looking sharp favorite ice skates kids toddlers teens,ice skates kids toddlers teens
493,493,1079499979914391557,best laptops kids top picks elementary school high school,laptops kids picks school school
494,494,1079473594118406145,best matching family pajamas sets according reviews,family pajamas sets reviews
495,495,1079467901273411586,play mats diaper bags baby gear buying nordstrom half yearly sale,play mats bags baby sale
496,496,1079208258391412737,favorite toys kids special needs,toys kids needs
497,497,1079151936652353536,sweet books grandparents read grandkids,books grandparents grandkids
498,498,1079125012144111616,score amazon fire tablet kids edition sale right,score amazon fire tablet kids sale right
499,499,1079098523445063680,little luxuries moms love nordstrom half yearly sale,luxuries moms sale
500,500,1078801163439476740,snow day activities beat winter boredom,day activities winter boredom
501,501,1078770344675164161,instant pot baby monitor gaming headphones see favorite finds amazon massive year end,pot baby monitor headphones finds year end
502,502,1078726386393759749,top educational video games boost kid brain power,video games kid brain power
503,503,1078682592713588738,gifts new parents,gifts parents
504,504,1078433134176321539,decorative dollhouses girls boys,dollhouses girls boys
505,505,1078409143814422529,step away diaper bag kate spade iconic handbags right,step bag kate handbags
506,506,1078360795103277057,stylish maternity coats keep baby warm weather,maternity coats baby warm weather
507,507,1078355314976718848,jeans dresses underwear love fashionable maternity finds nordstrom half yearly,jeans dresses maternity half
508,508,1078334195527835648,keep kids healthy winter fsa eligible products walgreens save exclusive,kids winter fsa products walgreens
509,509,1078101925990748160,little luxuries moms love nordstrom half yearly sale,luxuries moms sale
510,510,1078089705139392513,score amazon fire tablet kids edition major savings right,score amazon fire tablet kids edition savings
511,511,1077995433291583488,favorite cold weather finds girls boys abercrombie kids co esg aawmcq,cold weather girls kids aawmcq
512,512,1077993086205288448,boppy pillows strollers diaper bags baby gear buying nordstrom epic half yearly sale,strollers bags baby half sale
513,513,1077939472484962304,amazon year end deals something whole family shop favorite finds gone,year end deals something family shop
514,514,1077683692724731905,subscription boxes make great gifts moms co unmum,subscription boxes gifts moms
515,515,1077627254279208961,top educational video games boost kid brain power co pzay rqcvf,video games kid brain power co pzay rqcvf
516,516,1077334913781846019,best gifts grandparents make favorite,gifts grandparents
517,517,1077321441085919237,great gift ideas kids obsessed surprise,gift ideas kids surprise
518,518,1077302786407256069,get spirit season best christmas movies kids,spirit season christmas movies kids
519,519,1077275985895190528,best matching family pajamas sets according reviews,family pajamas sets reviews
520,520,1077235101111586820,finding right reader kids tricky broken best devices devouring,reader kids devices
521,521,1076988705624199169,last minute gifts tweens,minute gifts tweens
522,522,1076966763915550723,last minute christmas gifts kids,minute gifts kids
523,523,1076948861925670912,best phones kids elementary age high schoolers,phones kids age schoolers
524,524,1076826679966863360,best stocking stuffers moms,stuffers moms
525,525,1076718724227440640,gifts new parents,gifts parents
526,526,1076628268655222784,ready buy laptop kid best options,kid options
527,527,1076608711286800385,best ugly christmas sweaters babies toddlers kids plus cute styles,sweaters babies toddlers kids styles
528,528,1076586280153169920,adorable baby christmas gift ideas,baby christmas gift ideas
529,529,1076571020763561984,still searching perfect toy check top picks target,check top picks target
530,530,1076544973640749057,subscription boxes make great gifts moms co unmum,subscription boxes gifts moms
531,531,1076253832991174656,listen best reviewed headsets co mnwhcrt gc,headsets mnwhcrt gc
532,532,1076227773537103873,teddy ruxpin leapfrog leaptop awesome toys toddlers,ruxpin leapfrog toys toddlers
533,533,1076198465204613121,tips traditions baby first christmas,tips traditions christmas
534,534,1076177740892643328,favorite christmas holiday books kids,christmas holiday books kids
535,535,1076155653876600833,still looking gift ideas check top toys amazon christmas wish list,gift ideas toys list
536,536,1075922682636627970,save last minute gifts pottery barn kids get time christmas,gifts pottery barn kids time christmas
537,537,1075895462425698304,last minute christmas gifts kids amazon prime,minute gifts kids
538,538,1075836629548523521,last minute gifts tweens amazon prime,minute gifts
539,539,1075816482171437056,car ride activities kids keep busy,car ride activities kids
540,540,1075792874841784320,awesome snow sleds kids make spirits soar,sleds kids spirits
541,541,1075791158092140546,last chance save big toys walmart get shipped time christmas,chance toys time christmas
542,542,1075555029577318400,tweens tough shop work,tweens shop work
543,543,1075498542301622274,easy christmas crafts activities kids,crafts activities kids
544,544,1075463311918030850,give shrink small enough fit one awesome dollhouses girls boys,shrink girls boys
545,545,1075431916650881024,sweet books grandparents read grandkids,books grandparents grandkids
546,546,1075234255972773888,best last minute gifts tweens amazon,minute gifts amazon
547,547,1075207738999873536,better way get spirit holiday season watching christmas movies,way holiday season christmas movies
548,548,1075120484088496129,happened writer gave kids experience gifts christmas instead stuff,writer kids experience gifts stuff
549,549,1075098873994076161,say cheese favorite cameras kids toddlers teens co gawfrupzxc,cameras kids toddlers teens gawfrupzxc
550,550,1075066170636730371,best matching family pajamas sets according reviews,family pajamas sets reviews
551,551,1074752881692160003,best stocking stuffers moms,stuffers moms
552,552,1074739716514349056,best star wars christmas gifts kids,star wars gifts kids
553,553,1074726436282527746,ugly christmas sweaters babies toddlers kids plus cute styles,sweaters babies toddlers kids styles
554,554,1074707395467767808,looking sharp favorite ice skates kids toddlers teens,ice skates kids toddlers teens
555,555,1074449896617459712,luxury gifts mom dad guaranteed make favorite child,luxury gifts child
556,556,1074420604277788677,unique thoughtful teacher gift ideas,teacher gift ideas
557,557,1074385894805827584,top toys amazon christmas wish list co olydyosdxu,toys list co olydyosdxu
558,558,1074363815859499008,christmas almost check top toys target wish list,christmas toys list
559,559,1074080274407927809,furreal pets every kid want christmas plus buy,pets kid christmas
560,560,1074061480428036101,must products toddlers break bank,products toddlers bank
561,561,1074029851609350144,difference vaporizer humidifier best baby,difference vaporizer baby
562,562,1074002898667888640,found best readers kids toddlers teens,readers kids toddlers teens
563,563,1073725880139173888,best maternity leggings every stage pregnancy,maternity leggings stage pregnancy
564,564,1073689029089087494,favorite christmas holiday books kids,christmas holiday books kids
565,565,1073660476456951811,flying somewhere kids holiday season try activities keep entertained airplane,kids holiday season try activities airplane
566,566,1073639382572249088,xbox one games kids want score co rnmdxj sc,xbox games kids score co rnmdxj sc
567,567,1073612402707574784,top toys want walmart christmas,toys walmart christmas
568,568,1073353234314608642,great gift ideas kids obsessed surprise,gift ideas kids surprise
569,569,1073341304984231937,driving long distances holidays activities keep kids busy car,distances activities kids car
570,570,1073328943128813568,fun ideas baby st birthday party,fun ideas birthday party
571,571,1073306306629517312,top educational video games boost kid brain power,video games kid brain power
572,572,1073286688590491648,favorite cold weather finds girls boys abercrombie kids,cold weather girls kids
573,573,1073254099666255874,best inexpensive stocking stuffers kids,stuffers kids
574,574,1073015811462311937,best baby bottles newborns babies,baby bottles babies
575,575,1072984536462569473,hunt perfect ugly christmas sweater kids got gift,hunt kids gift
576,576,1072951703878713345,best personalized books kids,books kids
577,577,1072917142826295298,pomsies toy every kid wants christmas buy,pomsies kid buy
578,578,1072897366443864065,babies come manual came guide baby hair care infant hair products,babies hair care hair products
579,579,1072610341878726656,easy christmas crafts activities kids,crafts activities kids
580,580,1072597009129975808,best phones kids elementary age high schoolers,phones kids age schoolers
581,581,1072579674478444548,better way get spirit holiday season watching christmas movies,way holiday season christmas movies
582,582,1072559482209738753,fingerlings hugs animals even cuter cuddlier real pets,fingerlings animals pets
583,583,1072530313035825152,today walmart sale includes hatchimals nerf surprise season hottest toys co kgiranib,today sale hatchimals season toys kgiranib
584,584,1072526133650964481,toys great kids special needs,kids needs
585,585,1072506543239774209,best stocking stuffers moms,stuffers moms
586,586,1072479563626758144,amazon fire tablet kids edition makes great holiday gift kids sale right,amazon fire tablet kids edition gift kids sale right
587,587,1072233571677552640,whether child still swaddling crib night taking driver permit soo,child crib night driver permit soo
588,588,1072215974630318080,create ultimate gaming experience tvs video game consoles headsets,create gaming experience tvs video game consoles headsets
589,589,1072198340815843334,best breast pumps according experts,breast pumps experts
590,590,1072170491685822464,kids going mad grumblies christmas meet must monsters,kids grumblies meet monsters
591,591,1072121952024825857,luxury gifts mom dad guaranteed make favorite child,luxury gifts child
592,592,1071955476496203776,save extra already marked handbags kate spade epic sale buying,kate sale buying
593,593,1071913149195005952,christmas almost check top toys target wish list,christmas toys list
594,594,1071903645262852096,best star wars christmas gifts kids,star wars gifts kids
595,595,1071861030563782657,unique thoughtful teacher gift ideas,teacher gift ideas
596,596,1071849938445852673,say cheese favorite cameras kids toddlers teens co gawfrupzxc,cameras kids toddlers teens gawfrupzxc
597,597,1071832074292772864,best matching family pajamas sets according reviews,family pajamas sets reviews
598,598,1071593084713136128,happened writer gave kids experience gifts christmas instead stuff,writer kids experience gifts stuff
599,599,1071561003496816640,found best readers kids toddlers teens,readers kids toddlers teens
600,600,1071547964257157120,best ugly christmas sweaters babies toddlers kids plus cute styles,sweaters babies toddlers kids styles
601,601,1071537133612081152,great gift ideas kids obsessed surprise,gift ideas kids surprise
602,602,1071523244979703808,happened writer gave kids experience gifts christmas instead stuff,writer kids experience gifts stuff
603,603,1071422556547244037,today amazon big savings baby gear car seats baby monitors,today savings baby car seats monitors
604,604,1071250100054310912,moms step away diaper bag kate spade iconic handbags right,moms bag kate handbags
605,605,1071183081476886528,family health guide call doctor fever,family health guide call doctor fever
606,606,1071153924558778368,furreal pets every kid want christmas plus buy,pets kid christmas
607,607,1071117423460401153,favorite cold weather finds girls boys abercrombie kids,cold weather girls kids
608,608,1071081180861222912,best playstation games kids earn cool points,playstation games kids points
609,609,1070826948455223298,top toys amazon christmas wish list co olydyosdxu,toys list co olydyosdxu
610,610,1070786250045558785,tips traditions make baby first christmas extra special,tips traditions baby
611,611,1070753336423604225,best laptops kids top picks elementary school high school,laptops kids picks school school
612,612,1070721279450365952,favorite gift ideas moms,gift ideas moms
613,613,1070496669991612423,show holiday spirit easy christmas crafts kids,show holiday spirit christmas crafts kids
614,614,1070470916121989120,walmart dashing deals sale includes big savings barbie dream house surprise,walmart deals sale savings dream house surprise
615,615,1070406856626106368,say cheese best cameras kids ages,cameras kids ages
616,616,1070358451027615744,adorable baby christmas gift ideas,baby christmas gift ideas
617,617,1070165866795450368,pint size furniture decorations double playtime favorites best playroom ideas,pint size furniture decorations favorites playroom ideas
618,618,1070163796163989505,last chance amazon days deals toys ends tonight shop favorite picks,chance days deals ends shop favorite picks
619,619,1070060416666087425,best inexpensive stocking stuffers kids,stuffers kids
620,620,1070052865711005698,amazon days deals includes hatchimals paw patrol toys sale buying co ir zdnzusn,days deals hatchimals patrol sale co ir zdnzusn
621,621,1070035505687994373,best christmas gifts tweens teens,christmas gifts teens
622,622,1070015638851239936,got game best video game consoles kids,game video game consoles kids
623,623,1069686561372078081,star wars gift picks perfect pint sized jedi wannabe life,star wars gift picks pint jedi wannabe life
624,624,1069657166540357636,three crowd get kid sleep bed,crowd sleep bed
625,625,1069624016032464898,gotta catch em top pok games kids,gotta catch em pok games kids
626,626,1069595955224289280,video game gaming bargains scoring amazon days deals,video game gaming bargains days deals
627,627,1069396028527394817,best xbox one games kids want score,xbox games kids score
628,628,1069359804714487808,popular lullaby lyrics guarantee sweet dreams,lullaby lyrics dreams
629,629,1069337260498272258,toys great kids special needs,kids needs
630,630,1069309433950466048,best matching family pajamas sets according reviews,family pajamas sets reviews
631,631,1069014255725412353,gifts grandparents make favorite,gifts grandparents
632,632,1068983565877198849,best ugly christmas sweaters babies toddlers kids plus cute styles,sweaters babies toddlers kids styles
633,633,1068928624210907136,unique thoughtful teacher gift ideas,teacher gift ideas
634,634,1068619478844563456,implantation bleeding vs period spot early pregnancy symptom,implantation period pregnancy symptom
635,635,1068535339638276097,year give experience gift instead stuff try fun ideas,year experience gift try fun ideas
636,636,1068313070697615365,cyber week still going strong snag popular toys steal amazon,cyber week snag toys amazon
637,637,1068292551675908097,humidifiers vaporizers best baby got answers,humidifiers vaporizers baby answers
638,638,1068262945090502657,hot christmas toys flying shelves get gone,christmas shelves
639,639,1068205697219858432,favorite gift ideas moms,gift ideas moms
640,640,1067990548387192833,elf shelf grinch best holiday books kids,elf holiday books kids
641,641,1067944020217872384,luxury gifts mom dad guaranteed make favorite child,luxury gifts child
642,642,1067893643791532032,pomsies toy every kid wants christmas buy,pomsies kid buy
643,643,1067888903192027142,flying somewhere little ones holidays keep entertained,ones holidays
644,644,1067537488535842821,fingerlings hugs animals even cuter cuddlier real pets co bxtbvppqmk,fingerlings animals pets bxtbvppqmk
645,645,1067523894695903232,gear realize needed ages,realize ages
646,646,1067499784636907520,babies come manual breaking everything need know baby hair care infant,babies breaking everything need hair care infant
647,647,1067478432911630339,make baby first christmas special festive ideas wait till see pick baby first chri,baby ideas till baby chri
648,648,1067449964417171456,weather outside frightful love indoor birthday party ideas kids,weather love indoor birthday party ideas kids
649,649,1067240776424407040,amazon cyber monday sale ending soon get hot toys deals gone,amazon cyber sale deals
650,650,1067218449754202116,last chance save big toys video games electronics walmart massive cyber monday sale,chance toys games electronics cyber monday sale
651,651,1067196839018016771,target cyber monday deals include hundreds toys see toys holiday wish list,target cyber deals hundreds toys list
652,652,1067174655549759489,furreal pets toy every kid wants christmas score steal cybe,pets kid score steal cybe
653,653,1067124691427618818,kindle ipad best readers kids,ipad readers kids
654,654,1067115912963198976,fun adorable finds make perfect baby gifts bundle joy another little one love,fun finds baby gifts joy love
655,655,1067100565916844032,let talk sex everything need plan gender reveal party,sex everything need plan party
656,656,1067086278997536769,amazon cyber monday sale major savings season hottest toys including furreal friends pets,amazon cyber sale savings season toys friends pets
657,657,1067045441190199296,starting today score amazon cyber monday steals parenting essentials including baby monitors booster seats,today cyber monday steals essentials baby monitors seats
658,658,1066838480872005633,holiday gift ideas grandparents guaranteed make kid favorite,holiday gift ideas grandparents kid
659,659,1066803926488489988,fun personalized storybooks kids combine entertainment education making budding bookworm,fun kids entertainment education bookworm
660,660,1066776004931272704,kids going mad grumblies christmas meet must monsters,kids grumblies meet monsters
661,661,1066753949166915584,looking inexpensive stocking stuffers kids try little treasures,stuffers kids treasures
662,662,1066731044378939392,last chance walmart epic black friday sale ends tonight score major deals toys games electronics,chance sale ends deals games electronics
663,663,1066498652078780416,educational video games kids help little ones build skills like math history language proble,video games kids ones skills math history language
664,664,1066462002044985348,get spirit holiday season fun festive family christmas movies,holiday season fun family christmas movies
665,665,1066432484013953024,kids thrilled receive one favorite toys amazon christmas,kids christmas
666,666,1066395563501998080,looking fun festive family pajamas best sets according reviews,fun family pajamas sets reviews
667,667,1066114727506513921,stocking video games black friday playstation games earn cool points,video games playstation games points
668,668,1066080376920133633,shopping phone kids black friday want check top smartphone picks chil,phone kids friday check smartphone picks
669,669,1066004181125877761,create ultimate gaming experience walmart deals tvs video game consoles headsets,create gaming experience deals game consoles headsets
670,670,1065978968204029952,amazon black friday sale save big toys baby gear electronics,sale toys baby electronics
671,671,1065748293370765312,shopping laptop black friday check picks best laptops kids,friday check laptops kids
672,672,1065725958102106113,got game best video game consoles kids,game video game consoles kids
673,673,1065670202866716688,time black friday sharing favorite toys target get gone,time friday toys
674,674,1065639375869026305,walmart black friday sale toys adding christmas wish list,sale toys list
675,675,1065397875675459584,experts say fun family board games boost slew skills help kids better school,experts family board games slew skills school
676,676,1065363309304717312,beat crowds shop awesome toys amazon early black friday sale right,beat crowds shop toys sale right
677,677,1065352166007808001,potty training days yes done,training days
678,678,1065326722005041152,breast pump choose could make big difference pumping experience models recommend,breast pump choose difference experience models
679,679,1065273735484194816,choosing right xbox one game hard made easy rounded top,xbox game top
680,680,1065001533719437312,invitations party supplies everything need throw truly special first birthday party,invitations party supplies everything birthday party
681,681,1064974896655155202,baby alive kumikreator crate creatures see target toys top christmas list,baby kumikreator crate creatures target toys christmas list
682,682,1064948197158735872,gotta catch em little one love top pok game picks kids,gotta catch love top pok game kids
683,683,1064917235771281410,kids gobble thanksgiving craft ideas,kids craft ideas
684,684,1064632859061874691,spoil mom budget friendly stocking stuffers cost less,spoil mom budget stuffers cost
685,685,1064600657674539009,trying conceive boy hoping girl fun tips try tip scales,boy fun tips tip scales
686,686,1064579338111201280,finding right reader tricky check top picks devices kid devouring,reader check top picks devices
687,687,1064552549443866626,grumblies pomsies lego see toys want walmart year co tgagcbecxa,grumblies pomsies year co tgagcbecxa
