,Unnamed: 0,id,cleaned_word_list,cleaned_word_list_nouns
750,750,1036641244213067778,wins outside london restaurant year decision vote,wins london year decision vote
751,751,1036630076098596865,takes win outside london restaurant year,win london year
752,752,1036622404620038144,crowned london restaurant year decide,year decide
753,753,1036599851188989952,seduced could win london restaurant year vote,year vote
754,754,1035540237773099010,october issue shelves real corker free page italian supplement seasonal,issue shelves corker page supplement
755,755,1035225968942751744,sun sand sea without swarms tourists need scrap spot picked best hotels,sun sand sea swarms tourists spot hotels
756,756,1034501268931313664,cruise free dine dance laugh explore relax award winning ships designe,cruise dine dance laugh explore relax ships designe
757,757,1034501259137560577,found centre ukraine one europe oldest cities heavenly religious sites lively neighbourhood,europe cities sites
758,758,1034486150130532358,craving tuesday teatime treat rustle ultimate cheeseburger complete dirty onions smoked garlic,treat cheeseburger dirty onions
759,759,1034138759170875399,sardinero beach cantabria surfers paradise broad sandy beaches picture perfect waves find wh,sardinero beach cantabria surfers sandy beaches waves wh
760,760,1033776293576417280,time plaice herb rolled fish fillets lemony egg sauce finish sprinkle,time plaice herb fillets egg sprinkle
761,761,1033413895493505024,bao buns vital component taiwanese street food find permanent london location,bao buns component street food london location
762,762,1033051672162066432,stretch legs discover europe foot epic coastal tracks take vineyard clifftop,stretch foot epic tracks vineyard clifftop
763,763,1032689271810011136,recreate big screen experience comfort living room home movie recipe st,recreate screen experience comfort living room home movie recipe st
764,764,1032326894795071488,peppered independent retailers fashionable bars folkestone harbour arm tipped new place,retailers bars arm place
765,765,1031964574294200320,eat freshly sliced sashimi nishiki market discovering ornate hand painted details nijo castle kyoto,eat market hand details castle kyoto
766,766,1031602081147379714,running low school holiday activities look pick great coastal spots kids pack,school holiday activities spots kids pack
767,767,1031239562822074368,pimm clock transform everyone go summer time tipple delicious trifle thick lemon cur,pimm clock transform everyone summer time trifle lemon cur
768,768,1030786625004097536,venture beyond neon lights tenerife coastal strip discover exotic fruits growing island volcan,venture lights strip discover fruits island volcan
769,769,1030514925729402885,holiday makers enticed august seas red mullet migrate uk waters time year,holiday makers seas mullet migrate waters time year
770,770,1030152481899208710,make grape escape vineyards france italy beyond whining sip way thro,grape escape vineyards france way thro
771,771,1030127908201947136,hi kim dm us sort please sure letting vote,hi kim please vote
772,772,1030084341668425728,year michelin guide taipei first time ever giving away free whilst st,year michelin guide time whilst st
773,773,1029744840450486273,geographically inspired dishes served barcelona based restaurant swamp desert th,dishes barcelona restaurant swamp desert th
774,774,1029412648927088643,uk food festivals satisfy cravings well wanderlust fishing heritage weymouth,food festivals cravings heritage weymouth
775,775,1029020051767275520,classic gardener delight obscure green zebra tomatoes season sala,gardener obscure zebra tomatoes season sala
776,776,1028551736343056384,escape portugal bustling capital fairy tale hills sintra hidden lakes pastel mansions fantasti,escape portugal capital tale hills lakes mansions
777,777,1028310350712791040,eat way less wasteful living claiming uk first zero waste healthy eating restaurant,way living zero waste eating restaurant
778,778,1027963170877591553,uk temperatures soar need go abroad soak sun instead explore cobbled streets,temperatures need streets
779,779,1027600731724029953,delicate fruit short window ripeness tricky pinpoint get right savor th,fruit window ripeness pinpoint savor th
780,780,1025728323492696065,caribbean themed night head rums kitchen soho menu filled jerk chicken head,caribbean night head rums menu jerk chicken head
781,781,1025426471295348738,autumn europe means reaping rewards land rounded best holidays,europe rewards land holidays
782,782,1025391832983855104,europe largest japanese food hall open westfield london shepherd bush drop sho,food hall westfield london drop sho
783,783,1025041142440775680,summer salad game carpaccio courgette melted goat cheese dish honey dressing war,summer salad game carpaccio courgette goat honey war
784,784,1024641280515735552,us food travel summer means one thing one thing ice cream gone edinburgh leice,food travel summer thing thing ice cream leice
785,785,1024286179976466432,make season sweet stemmed cauliflower beans yellow courgettes crunchy summery dish,season sweet beans courgettes dish
786,786,1024278886115409920,ichiba europe largest japanese food hall open westfield london shepherd bush drop shop,food hall westfield london drop shop
787,787,1023999268342964224,edinburgh way sydney visited seven favourite destinations bring three locales,way sydney destinations locales
788,788,1023478330157355008,courtesy tasty tea infused bowl must try breakfast doubles delicious,courtesy tea bowl breakfast doubles
789,789,1023251967802580993,invites explore culinary discovery tours days ashore one many immersive,invites discovery tours days
790,790,1023176453087797249,ultimate cheeseburger nothing pure enjoyment succulent burger topped three types cheese smok,cheeseburger nothing pure enjoyment succulent burger types smok
791,791,1022866841918746626,garlicky luxurious dirty loaded lobster rolls need little splash lemon juice spoon,dirty lobster rolls lemon juice spoon
792,792,1022519575416631296,destination specialists bring together vast treasures world one else wit,destination specialists treasures world wit
793,793,1022519557792178178,whilst heat soars jump deep end first rate outdoor lidos across britain head loc,whilst heat soars end rate lidos britain head loc
794,794,1022104510569897984,harbouring glorious old town ancient fortified walls protect bounteous produce korcula,town ancient walls produce korcula
795,795,1021689007141531653,time fancy winning five night stay two vietnam head website,time night stay head website
796,796,1021432409873616899,festooned greenery botanical inspiration quaint informal south london restaurant holds respectfull,inspiration quaint restaurant
797,797,1020956726282072064,super sophisticated take dippy eggs soldiers try roasted asparagus parmesan crumbs soft egg,super take dippy eggs soldiers crumbs egg
798,798,1020692451516919813,two ingredients need make watermelon granita courtesy gelupo simple refreshing,ingredients watermelon granita courtesy gelupo simple refreshing
799,799,1020369028739731457,food friends flaming grills everybody loves festival check guide best food festivals,food friends grills everybody guide food festivals
800,800,1019997912879828992,transport cobbled streets italy paola bacchia polpettine di melanzane deep fried,transport streets polpettine di melanzane
801,801,1019499572291399680,fantastic produce outstanding restaurants lac du bourget food lover paradise check ou,produce restaurants bourget food lover paradise check ou
802,802,1019212743939969025,indulge little bit self love summer lovin bowl beetroot mango chilli bowl pa,bit love summer lovin bowl beetroot mango chilli bowl pa
803,803,1017801298463293442,office celebrating cooking curly prawns ginger chilli green tea nood,office prawns tea nood
804,804,1017793407379533826,foods bubble tea gua bao heart taiwanese life year michelin guide tai,foods gua heart life year michelin guide tai
805,805,1017732930590912512,aug sept double issue hit shelves today cracker inside expect pages inspira,aug issue shelves today pages
806,806,1017476330273890304,vivid melting pot colombian spanish african influences cartagena one latin america appealin,vivid pot influences latin america appealin
807,807,1017113912083435525,housed shadowy railway tunnel bookings policy restaurant perfectly encapsulates east,railway tunnel bookings policy
808,808,1016683819334856704,need night dinner inspiration try delicious halloumi burgers crisp halloumi gives,need night dinner inspiration halloumi burgers halloumi
809,809,1016222978269437953,balancing th century facade heritage old parsonage oxford ultimate definition picture pos,century facade heritage parsonage oxford definition picture pos
810,810,1015913506422566912,tart sweet raspberries pair beautifully vanilla almonds chocolate personal favourite ra,raspberries almonds favourite ra
811,811,1015573710307299328,round perfect alfresco afternoon simple bake incredibly moreish fragrant summer cake indulge,round perfect afternoon bake summer cake indulge
812,812,1015150910744465409,fancy spontaneous city break weekend head bustling cornish village st ives idyllic beaches,city break weekend head village st beaches
813,813,1014939551452844032,moroccan chickepea omelette proof need eggs make light fluffy omelett,chickepea omelette proof eggs fluffy
814,814,1014486595003613185,stock suncream grab passport head season hottest destinations history buffs,stock suncream grab passport head season destinations history buffs
815,815,1013678762771255296,hotel last year found quirky spots truly unique sleepovers around globe check,hotel year spots sleepovers globe check
816,816,1013369156790562818,pop kettle discover spain luscious cantabria dairy king anchovies legion read,pop discover cantabria dairy anchovies legion read
817,817,1012670811306627072,embrace sunshine serving stellar views great food good vibes one place check,embrace sunshine views food vibes place check
818,818,1012327365912027136,visit darcie may green complete without trying melbourne mars bar cheesecake ball gooey sp,visit darcie mars gooey sp
819,819,1012259361782206464,summer means perfect time discover beautiful french alps go semi self guided walk,summer means time discover alps self walk
820,820,1011662992071647232,someone say goat dinner head smoking goat soho soy smoked shoulder practically falls th,someone goat dinner head goat soho soy shoulder th
821,821,1010832451797647360,tempt cheesy texas meatballs dinner swimming rich smoky sauce finis,cheesy texas dinner smoky sauce finis
822,822,1010508035595362304,tempted order takeaway tonight experiment ching huang spicy honey garlic prawns chestnut,order takeaway experiment huang spicy honey prawns chestnut
823,823,1010181903083810816,north spain lies historic burgos city culinary roots past nose scenting th,lies city roots scenting th
824,824,1009460906441494528,different cuisines star global gourmet dining experiences spoilt choic,cuisines star gourmet dining experiences choic
825,825,1009085204420546562,rt summer finally celebrating july issue shelves today inside find everythin,rt summer issue shelves today find everythin
826,826,1008362400784011265,summer lively spanish capital mean one thing fiesta check hours madrid feature,summer capital thing fiesta check hours feature
827,827,1007563535541506048,need sunshine seclusion splendour gone search ultimate get away experience,need seclusion splendour search experience
828,828,1007299257337024512,enjoy quality experiences opportunities resort vote,enjoy quality experiences opportunities vote
829,829,1006212076463894529,step inside bohemian paradise breathe smell freshly baked pastries find petersham,step paradise breathe smell pastries petersham
830,830,1005411745018580992,keep light seasonal delicious simple salad chargrilled asparagus radicchio burrata,simple salad radicchio burrata
831,831,1005079596386127872,parquet flooring exposed brick walls old milk bottles full fresh flowers rattle owl showcases yor,parquet brick walls milk flowers showcases yor
832,832,1005057082662576128,summer finally celebrating july issue shelves today inside find everyt,summer issue shelves today find everyt
833,833,1004755340813062145,want learn wine sure start offers innovative,want learn wine start offers
834,834,1003973500825194496,revel gourmet food star global gourmet dining experiences one restaurants per resort,revel food star gourmet experiences restaurants resort
835,835,1003630046848929797,ending chicken lollipops packed contrasting flavours put smok,lollipops flavours smok
836,836,1003275203785510918,heading ibiza miss chance eat set inside old town walls,ibiza chance eat town walls
837,837,1003222300546732033,need vegetarian bbq inspiration try chicory pomegranate molasses,need bbq inspiration pomegranate molasses
838,838,1002875020497051648,inspired fond memories eating india tandoori sea bream chopped kachumba unique excitin,fond memories india tandoori sea bream excitin
839,839,1002542829380521985,fish chips always taste better sea celebrating th,chips sea th
840,840,1002210669926715393,indulge pinnacle luxury caribbean inclusive holidays vote win,pinnacle luxury holidays
841,841,1001878446048464900,luxury resort abounds floor ceiling windows wooden decor sympathetic surrounding te,luxury resort floor ceiling windows decor surrounding te
842,842,1001856206196101120,fish bbq always winner try fish tacos tangy fruit salsa che,bbq tacos tangy fruit salsa che
843,843,1001448408807366659,start going filling timelines smokin bbq recipes first,start timelines bbq recipes
844,844,1000730898990534656,looking fully immerse surroundings next holiday searched high low,surroundings holiday
845,845,1000293003699871744,need breakfast inspiration indulge roasted tomatoes stuffed egg bacon,need breakfast inspiration indulge tomatoes egg bacon
846,846,1000055189162819585,tucked away one london charming crevices historic st james stafford hotel plush bolthole th,london charming crevices st james hotel plush bolthole th
847,847,999643786753003520,perfect pre dinner nibble try simple yet delicious herring tomato toast,pre dinner try simple tomato toast
848,848,999228572693917697,feeling need pick one cardamom pistachio buns job nicely roll,cardamom pistachio buns job roll
849,849,999198398019338240,grab hiking boots europe inspiring coastal walks andrew eames hiked high,grab boots walks
850,850,998919026435854336,celebrating thing british starting simple tomato goat cheese rico,thing tomato goat cheese rico
851,851,998586842634244096,jordan capital reveals cosmopolitan flavours ancient architecture souks cultural hub repr,jordan capital reveals architecture hub repr
852,852,998141389455220737,ending favourite gourmet sarni try beef pickled red onion watercress,gourmet sarni try beef onion watercress
853,853,997809275669008384,split never far away smell freshly baked bread icy glass dalmatian wine rea,split bread icy glass wine rea
854,854,997499626767994881,nominations destination year,nominations destination year
855,855,997476976016412672,nominations destination year,nominations destination year
856,856,997386411442671616,drum roll please voting food travel reader awards officially open head website cast,drum roll please food travel reader awards head website cast
857,857,997138462775095296,romantic setting border cotswolds perfect reviving break enj,border cotswolds break enj
858,858,997122114900676608,nominations long haul airline year,nominations airline year
859,859,997084383096995841,nominations short haul airline year vote open,nominations haul airline year vote
860,860,997024060772159488,feeling creative delicious cardamom pistachio buns courtesy smell amazing taste eve,cardamom pistachio courtesy smell taste eve
861,861,996759746886725632,nominations retailer year opens,nominations year opens
862,862,996722000520470528,nominations cookery school year,nominations school year
863,863,996676758178009089,go danish trine hahnemann cheese sm delicious reimagining lunchtime,trine hahnemann lunchtime
864,864,996424993771806722,nominations boutique adventure cruise line year,nominations cruise line year
865,865,996392281920933889,nominations river cruise line year,nominations cruise line year
866,866,996355780017352706,nominations ocean cruise line year,nominations cruise line year
867,867,996336939736461316,ever considered small ship expert gary buchanan found stellar vessels,ship buchanan vessels
868,868,996050080774975496,need dinner inspiration try gaz oakley peri peri falafels tahini dressing,need dinner inspiration try gaz oakley peri peri falafels
869,869,996012412913487872,nominations book year,nominations book year
870,870,995272587818274817,mondenese best yes skilled dish essence celebration,essence celebration
871,871,994967823595266049,june issue shelves real corker free page kids special modern recipes fr,issue shelves corker page kids recipes
872,872,994932690431377408,nominations tour operator year,nominations operator year
873,873,994638500858384384,spend week baros find clich good thing palm trees sway wind white,spend week baros thing palm trees
874,874,994623218370711554,nominations bed breakfast year,nominations year
875,875,994593069122060293,nominations city hotel year,nominations city hotel year
876,876,994562805985611778,nominations rural hotel year,nominations hotel year
877,877,994532625678299136,nominations gourmet bolthole year,nominations year
878,878,994253216002002945,delighted announce bumper june issue shops free page kids special mo,announce issue shops page kids mo
879,879,994238157024571393,nominations bar year op,nominations year op
880,880,994230875389857793,plans summer check selection courses wonderful way,plans summer check selection courses way
881,881,994200453528334336,nominations chef year,nominations year
882,882,993913587184951296,nominations newcomer restaurant year,nominations year
883,883,993883489262071813,nominations timeless classic restaurant year,nominations restaurant year
884,884,993861424060526592,nominations outside london restaurant year,nominations london year
885,885,993845517284233217,looking holiday closer home book one two channel island way trips receive,holiday home book channel way trips
886,886,993822931397611520,nominations london restaurant year,nominations year
887,887,993528505840357376,uk first fully charitable food hall profits go,food hall profits
888,888,993490930522050561,drum roll please shortlist food travel reader awards announced june issue,drum roll please food travel reader awards issue
889,889,993067953636757516,really nothing better jersey royal potatoes dunked soft baked cheese afternoon indul,nothing jersey royal potatoes afternoon indul
890,890,992426255759888384,asparagus bang season delicious meal particularly love chargrilled radicchio burrata,asparagus bang season meal radicchio burrata
891,891,991742909501362178,europe hotting check best hotels private beaches feature serious inspirat,europe check hotels beaches inspirat
892,892,990863446261620736,time fancy winning week long holiday two luxurious bahamas today,time week bahamas today
893,893,990576592400379904,grab spoon dig deliciously satisfying grains greens bowl discover,grab spoon dig grains greens discover
894,894,990138630852239360,lazy follow us tunis atmospheric medina teeming warren narrow alleyways,lazy medina warren alleyways
895,895,989897440080859136,need dinner inspiration try beef ale pie chorizo check,need dinner inspiration try beef pie chorizo check
896,896,989504649614020608,need amman one accessible places experience middle eastern culture,need places experience culture
897,897,989061414986928128,looking fabulous editorial join us month email cv cover letter stephanie,editorial join month email cv cover letter stephanie
898,898,988825171829121025,food travel magazine pinterest check us recipes inspiration,food travel magazine pinterest recipes inspiration
899,899,988387298596282368,starting sticky ribs covered sweet spice marinade finger,ribs spice marinade finger
900,900,987949182127362048,need morning read check gourmet traveller taipei flavours fiery,need morning check traveller taipei fiery
901,901,987375520257118208,finally celebrating giving scoop best ice cream parlours uk,scoop ice cream parlours uk
902,902,986975265279574016,hours go nominations close last chance say,hours nominations chance
903,903,986928885827809281,chocolate ripple ice cream need say find co kyamsuqmbz,chocolate ripple ice cream kyamsuqmbz
904,904,985910804812845056,awards news extended deadline nominations friday,awards news nominations
905,905,985885564619624449,let hear blood oranges blushing beauties bang season read find tips,blood oranges beauties season tips
906,906,984457437196570625,roast sea bass charred asparagus spring onions avocado hummus spring plate quick healthy,roast sea bass spring onions spring plate quick
907,907,984099229051301888,feeling thirsty wine expert clinton cawood rounded world best wine holidays find,wine expert clinton cawood world wine holidays
908,908,983648776396197888,voting shortlist food travel reader awards open another days miss yo,shortlist food travel reader awards days yo
909,909,982890896613171201,ever tried savoury try japanese style one breakfast click rita serano,savoury style breakfast click rita serano
910,910,982302278844583941,dreaming weekend head quirky galleries boutique hotels sensational sea,weekend head galleries hotels sea
911,911,981932020879253505,worth julia child scholarship help kick start career food,julia scholarship help career food
912,912,981531920306761730,heading australia miss hours guide gold coast,hours gold coast
913,913,981207244653068288,inviting twinkling blue waters montenegro look travel cover may issue already fly,waters cover
914,914,981139521365577729,step lunch game papaya peanut salad try,step game papaya peanut salad try
915,915,980473651370786816,warm welcome alluring colour imaginative cocktails check floor building heart br,welcome cocktails floor building heart br
916,916,980384402827108352,readers spend day baking hot cross bun cupcakes fruit,readers day cross bun cupcakes fruit
917,917,979780563384094720,make even better add orange zest click delicious,click delicious
918,918,979040812301504512,fed cold need vitamin break rounds best shor,need vitamin rounds shor
919,919,978579949161500674,aga cookery school uk award winning country house offers,cookery school country house offers
920,920,978284223290372096,start kicking wellies sipping local beer fire heading artfully distresse,start wellies beer fire
921,921,977877920780881920,smoky grilled pineapple coconut whip desserts dreaming indulge,smoky coconut whip indulge
922,922,977243785309687811,florentine roast pork simple yet elegant makes perfect centerpiece lunch impress,florentine roast pork lunch impress
923,923,976828472130723840,head st ives bustling cornish village home thriving artis,head st village home thriving artis
924,924,975643172322926592,morning commute check month slate floor makes fe,morning commute month floor fe
925,925,975371421978447872,sweet potato chips spicy dip make perfect snack spices guac make,potato chips dip snack spices
926,926,974963745716887552,celebrate weekend break galway narrow medieval lanes historical site,weekend break galway lanes site
927,927,974737339997188097,mood weekend baking stilton walnut soda bread go treat fam,mood weekend walnut soda bread treat fam
928,928,973997544324960256,rupert rowley michelin starred plates turned edwardian manor something culinary magnet che,rupert rowley michelin plates manor something magnet che
929,929,973619986764845056,want escape get away thermal springs panoramic forest views menu native inspi,want escape springs views inspi
930,930,973227439022313472,need inspiration ditch meat experiment martin nordon vegetable filled burgers fa,inspiration meat martin nordon vegetable burgers
931,931,972759152446582784,treat mum weekend make warm date cake pecan caramel sauce courtes,treat weekend date cake caramel sauce courtes
932,932,972472416592105472,ending dinky little pork pies filled quail eggs pancetta fit,pork pies quail eggs fit
933,933,972075812508794880,way home read gourmet traveller feature australia high country,way home feature country
934,934,971823182826098688,alex chow brings together contemporary dishes retain essence conventional chinese cooking elemen,chow dishes cooking elemen
935,935,971415539464769537,sweet savoury pies personally love apple blueberry salted caramel jar pies,savoury pies apple blueberry jar pies
936,936,971068300829646848,need weekends activities rounded best dining rooms mus,weekends activities dining rooms
937,937,970615086938193920,kick start got warming beef ale pie chorizo spicy chorizo,start beef pie chorizo spicy chorizo
938,938,970297987992834050,need want spend days swimming bar ordering ginger martinis relaxing pri,need days bar ordering ginger martinis pri
939,939,969875145547534336,home argentina best colonial architecture wild westerly output makes perfect base touri,home argentina architecture output base touri
940,940,969603529223688193,may still bitterly cold outside warm belinda williams purple sprouting broccoli sou,warm belinda broccoli sou
941,941,969195634975797248,celebrate glyn purnell tasty slow cooked lamb recipe long cooking time allows lamb,celebrate glyn slow recipe time lamb
942,942,968893709034184705,nominations open annual reader awards seventh year set bigger tast,nominations reader awards year tast
943,943,968877237809315843,nobody could accuse zuma trading postcode every dish study authentic flavours artistic pre,nobody trading postcode dish study flavours pre
944,944,968508939737485312,top work looks delicious,work
945,945,968065489208475648,sprinkle little sunshine dishes delicious lemon recipes personal favourite,dishes lemon favourite
